408	174317419177840640	ohgay7	2012-02-27 21:18	0		 Abuse	39.21	-84.59	5km	Point	39.2413721	-84.62794933		Tue Feb 28 02:18:06 +0000 2012	@charmander2794 does Dominic abuse you? cause I will so kill him for you if you want..	
409	280201573009870848	TheWhyteKid	2012-12-16 01:43	0		 Abuse	39.23	-84.47	5km	Point	39.261854	-84.5093236	Cincinnati, Ohio	Sun Dec 16 06:43:55 +0000 2012	I'm Ben Whyte, and I abuse my pants on a regular basis.	
410	273999611339866112	TheWhyteKid	2012-11-28 22:59	0		 Abuse	39.23	-84.47	5km	Point	39.261823	-84.5092983	Cincinnati, Ohio	Thu Nov 29 03:59:32 +0000 2012	@1AndOnlyAbe I abuse mine by forcibly taking them off before bed... hahahaaha	
411	273644400637251584	TheWhyteKid	2012-11-27 23:28	0		 Abuse	39.23	-84.47	5km	Point	39.2618232	-84.5093017	Cincinnati, Ohio	Wed Nov 28 04:28:03 +0000 2012	I abuse my pants.	
412	270655329623216128	TheWhyteKid	2012-11-19 17:30	2	#WhenIWasACarrot #rapedcarrot	 Abuse	39.23	-84.47	5km	Point	39.2618165	-84.5092939	Cincinnati, Ohio	Mon Nov 19 22:30:33 +0000 2012	#WhenIWasACarrot people repeatedly dumped me in ranch, it was abuse. #rapedcarrot	
413	180888108357783554	ShamelessLeo	2012-03-17 01:27	0		 Abuse	39.23	-84.53	5km	Point	39.25703064	-84.57680905	Cincinnati, ohio	Sat Mar 17 05:27:40 +0000 2012	If my body can't put up with the abuse that a put it through.	
414	196343715013464065	_Timovia	2012-04-28 17:02	0	#Abuse	 Abuse	39.23	-84.56	5km	Point	39.2575122	-84.6019181	Atlanta, GA ⛺. Cincinnati OH 	Sat Apr 28 21:02:44 +0000 2012	RT @FashionistaMILA: I love when Tina beats up Ike in the car! Lmao ha #Abuse	
415	218188935745122304	bustyruckets	2012-06-27 23:47	0	#screwyoubrokenremote	 Abuse	39.25	-84.35	5km	Point	39.26912308	-84.30813026	new york	Thu Jun 28 03:47:50 +0000 2012	The cute dog animal abuse commercial came on and I couldn't get to my remote in time and now I am in tears #screwyoubrokenremote	
416	244206804177936384	Jefelemarc	2012-09-07 18:53	0		 Abuse	39.25	-84.44	5km	Point	39.28977	-84.45864	Queen City, Ohio	Fri Sep 07 22:53:33 +0000 2012	"@RAPTORS416: Niggas will abuse lakers heat and OKC in NBA 2K13" like they did 2k12	
417	235805562040885248	RichMoneyCoop	2012-08-15 14:30	1		 Abuse	39.25	-84.47	5km	Point	39.27538789	-84.50574217		Wed Aug 15 18:30:01 +0000 2012	These animal abuse commercials be zonin me out..	
418	153938115562708992	qiladean	2012-01-02 15:38	0		 Abuse	39.25	-84.47	5km	Point	39.27788995	-84.51166083	cincinnati at the moment 	Mon Jan 02 20:38:01 +0000 2012	@EXPRESS_lifeee I don't abuse animals I just highly dislike  them	
419	228012370134433792	insanNigga	2012-07-25 02:22	0		 Abuse	39.25	-84.5	5km	Point	39.28149033	-84.5236702	cincinnati's Lowner 	Wed Jul 25 06:22:39 +0000 2012	Most of these Women Use N Abuse, Callin U niggas Up to Pay they Dues.	
420	216303548495966208	Chez_The_Rapper	2012-06-22 18:55	0		 Abuse	39.25	-84.56	5km	Point	39.28744474	-84.57435162	Cincinnati ✈️ Mexico	Fri Jun 22 22:55:59 +0000 2012	@golden_girly you abuse me..	
421	207697912333991938	BeeMarieXOXO	2012-05-30 01:00	0	#50ThingsiHate	 Abuse	39.25	-84.56	5km	Point	39.28621006	-84.57285023	Cincinnati	Wed May 30 05:00:15 +0000 2012	#50ThingsiHate people who abuse or kill their kids for no reason	
422	279959706347393024	AllisonRArnold	2012-12-15 09:42	1		Accused	39.05	-84.35	5km	Point	39.05540122	-84.31227227	Gastonia, NC	Sat Dec 15 14:42:50 +0000 2012	Feeling awful for the school tragedy killer's brother who was wrongly accused by the media. Slow down and get facts right. Ethics.	
423	218860283911876609	iDirtyScott	2012-06-29 20:15	0	#geez	Accused	39.05	-84.35	5km	Point	39.0515556	-84.3062347	Cincinnati	Sat Jun 30 00:15:32 +0000 2012	Accused of everything around here.. #geez	
424	218013478659702784	DireEpidemic	2012-06-27 12:10	0		Accused	39.05	-84.35	5km	Point	39.0614553	-84.374606	Internet	Wed Jun 27 16:10:38 +0000 2012	"@HuffingtonPost: FBI arrests accused credit card hackers in international crackdown http://t.co/Zz1hF7x7" Gratz FBI u got 24 out of 2k. &gt;_&gt;	
425	194506192062644224	45230	2012-04-23 15:21	0		Accused	39.05	-84.35	5km	Point	39.077778	-84.385358	45230	Mon Apr 23 19:21:04 +0000 2012	Jean-Robert de Cavel accused of impaired driving http://t.co/La9GzYUZ via http://t.co/vOvTjLtj	
426	256211426916581376	JCraigKY	2012-10-10 21:55	0		Accused	39.05	-84.47	5km	Point	39.04893025	-84.51022435	USA	Thu Oct 11 01:55:39 +0000 2012	@Macie_Boughton And all the information I've obtained &amp; absorbed without MSM bias, I'm accused as well as having "talking points"...okay.	
427	160706644542619650	LANIJO58	2012-01-21 07:53	0		Accused	39.05	-84.47	5km	Point	39.07954627	-84.5191221	Kentucky & Ohio	Sat Jan 21 12:53:44 +0000 2012	@cspanwj Connelly Remember reverend Jerimiah that everyone accused Obama as being a terrorists funny no republicans remember.	
428	262651365325697024	yatown_news	2012-10-28 16:25	0	#Amsterdam #Covington #KY	Accused	39.05	-84.5	5km	Point	39.05906	-84.542748	Silicon Valley	Sun Oct 28 20:25:39 +0000 2012	Suit accused St. E of double billing -Cincinnati.com http://t.co/rssyczIX #Amsterdam #Covington #KY	
429	261926503317655552	yatown_news_pm	2012-10-26 16:25	0	#Ludlow #Covington #KY	Accused	39.05	-84.5	5km	Point	39.05906	-84.542748	Silicon Valley	Fri Oct 26 20:25:19 +0000 2012	Suit accused St. E of double billing -Cincinnati.com http://t.co/khh2lB15 #Ludlow #Covington #KY	
430	241633163665874944	yatown_news	2012-08-31 16:26	0	#KentonHills #Covington #KY	Accused	39.05	-84.5	5km	Point	39.05906	-84.542748	Silicon Valley	Fri Aug 31 20:26:50 +0000 2012	NKY mayor accused of defying judge's orders -kypost.com http://t.co/uitwgM2r #KentonHills #Covington #KY	
431	227862158648696832	yatown_news	2012-07-24 16:25	0	#Ludlow #Covington #KY	Accused	39.05	-84.5	5km	Point	39.05906	-84.542748	Silicon Valley	Tue Jul 24 20:25:46 +0000 2012	Man accused of sexually assaulting teen -Cincinnati.com http://t.co/9ZZBjuYn #Ludlow #Covington #KY	
432	221188214571020289	yatown_news	2012-07-06 06:25	0	#LatoniaTerrace #Covington #KY	Accused	39.05	-84.5	5km	Point	39.05906	-84.542748	Silicon Valley	Fri Jul 06 10:25:54 +0000 2012	Judge to accused dealers: 'Heroin is killing the community' -kypost.com http://t.co/Y7UAgdUY #LatoniaTerrace #Covington #KY	
433	219013210647429120	yatown_news	2012-06-30 06:23	0	#LatoniaTerrace #Covington #KY	Accused	39.05	-84.5	5km	Point	39.05906	-84.542748	Silicon Valley	Sat Jun 30 10:23:13 +0000 2012	Judge to accused dealers: 'Heroin is killing the community' -kypost.com http://t.co/Y7UAgdUY #LatoniaTerrace #Covington #KY	
434	216990529706139648	yatown_news	2012-06-24 16:25	0	#FortWright #Covington #KY	Accused	39.05	-84.5	5km	Point	39.05906	-84.542748	Silicon Valley	Sun Jun 24 20:25:48 +0000 2012	Former NKY police chief accused of credit card fraud -Cincinnati.com http://t.co/yJUR1NUy #FortWright #Covington #KY	
435	216627823593537536	yatown_news	2012-06-23 16:24	0	#WestCovington #KY	Accused	39.05	-84.5	5km	Point	39.05906	-84.542748	Silicon Valley	Sat Jun 23 20:24:32 +0000 2012	Niece: Man accused of murder being framed -Cincinnati.com http://t.co/2NUMTKId #WestCovington #KY	
436	214979006863388674	topix_ky	2012-06-19 03:12	0	#HighlandHeights #Kentucky	Accused	39.05	-84.5	5km	Point	39.071984	-84.5298545	Kentucky	Tue Jun 19 07:12:44 +0000 2012	Former NKY police chief accused of credit card fraud - http://t.co/sn5EF8LX #HighlandHeights #Kentucky	
437	214815558431023105	yatown_news	2012-06-18 16:23	0	#FortMitchell #Covington #KY	Accused	39.05	-84.5	5km	Point	39.05906	-84.542748	Silicon Valley	Mon Jun 18 20:23:14 +0000 2012	Former NKY police chief accused of credit card fraud -Cincinnati.com http://t.co/W0ibDucH #FortMitchell #Covington #KY	
438	212640799127650304	yatown_news	2012-06-12 16:21	0	#WestCovington #KY	Accused	39.05	-84.5	5km	Point	39.05906	-84.542748	Silicon Valley	Tue Jun 12 20:21:31 +0000 2012	Niece: Man accused of murder being framed -Cincinnati.com http://t.co/2NUMTKId #WestCovington #KY	
439	193435802666143744	yatown_news	2012-04-20 16:27	0	#LookoutHeights #Covington #KY	Accused	39.05	-84.5	5km	Point	39.05906	-84.542748	Silicon Valley	Fri Apr 20 20:27:43 +0000 2012	Accused murderer believes victim isn't dead -Cincinnati.com http://t.co/qm2fDeiJ #LookoutHeights #Covington #KY	
440	192349046533398528	yatown_popular	2012-04-17 16:29	0	#FortMitchell #Covington	Accused	39.05	-84.5	5km	Point	39.0595	-84.54744	Silicon Valley	Tue Apr 17 20:29:21 +0000 2012	Accused murderer believes victim isn't dead http://t.co/c9BMuEgU Most read by neighbors in #FortMitchell #Covington	
441	192348169839984643	yatown_news_pm	2012-04-17 16:25	0	#FortMitchell #Covington #KY	Accused	39.05	-84.5	5km	Point	39.05906	-84.542748	Silicon Valley	Tue Apr 17 20:25:52 +0000 2012	Accused murderer believes victim isn't dead -Cincinnati.com http://t.co/Bb6h1vLJ #FortMitchell #Covington #KY	
442	185526871767777281	topix_ky	2012-03-29 20:40	0	#Covington #Kentucky	Accused	39.05	-84.5	5km	Point	39.0665025	-84.5336866	Kentucky	Fri Mar 30 00:40:27 +0000 2012	Ben-Gal Accused of Sex with Student - http://t.co/wPcOFnOo #Covington #Kentucky	
443	172280539867385856	yatown_news	2012-02-22 06:24	0	#FortWright #Covington #KY	Accused	39.05	-84.5	5km	Point	39.05906	-84.542748	Silicon Valley	Wed Feb 22 11:24:16 +0000 2012	Man accused of abducting woman from Crestview Hills Town Center indicted on ... -kypost.com http://t.co/7PmIwpaS #FortWright #Covington #KY	
444	169169746032459776	yatown_news	2012-02-13 16:23	0	#Bromley #Covington #KY	Accused	39.05	-84.5	5km	Point	39.05906	-84.542748	Silicon Valley	Mon Feb 13 21:23:05 +0000 2012	Bengals linebacker Rey Maualuga accused of assault in bar -Cincinnati.com http://t.co/tXhtp1if #Bromley #Covington #KY	
445	168808380255846400	yatown_news	2012-02-12 16:27	0	#Bromley #Covington #KY	Accused	39.05	-84.5	5km	Point	39.05906	-84.542748	Silicon Valley	Sun Feb 12 21:27:08 +0000 2012	Bengals linebacker Rey Maualuga accused of assault in bar -Cincinnati.com http://t.co/tXhtp1if #Bromley #Covington #KY	
446	168445738798419968	yatown_news	2012-02-11 16:26	0	#Covington #KY	Accused	39.05	-84.5	5km	Point	39.05906	-84.542748	Silicon Valley	Sat Feb 11 21:26:08 +0000 2012	Bengals linebacker Rey Maualuga accused of assault in bar -Cincinnati.com http://t.co/hCURYm5J #Covington #KY	
447	261926800312115200	yatown_popular	2012-10-26 16:26	0	#Ludlow #Covington	Accused	39.05	-84.53	5km	Point	39.09256	-84.54744	Silicon Valley	Fri Oct 26 20:26:30 +0000 2012	Suit accused St. E of double billing http://t.co/1hsfZHCO Most read by neighbors in #Ludlow #Covington	
448	169185271450046464	yatown_popular	2012-02-13 17:24	0	#Bromley #Covington	Accused	39.05	-84.53	5km	Point	39.082	-84.56022	Silicon Valley	Mon Feb 13 22:24:46 +0000 2012	Bengals linebacker Rey Maualuga accused of assault in bar http://t.co/UiyiHqfi Most read by neighbors in #Bromley #Covington	
449	168822520013795331	yatown_popular	2012-02-12 17:23	0	#Bromley #Covington	Accused	39.05	-84.53	5km	Point	39.082	-84.56022	Silicon Valley	Sun Feb 12 22:23:20 +0000 2012	Bengals linebacker Rey Maualuga accused of assault in bar http://t.co/pc6wtQcq Most read by neighbors in #Bromley #Covington	
450	243605429568040960	topix_ky	2012-09-06 03:03	0	#VillaHills #Kentucky	Accused	39.05	-84.56	5km	Point	39.0536558	-84.5969702	Kentucky	Thu Sep 06 07:03:55 +0000 2012	N.Ky. mayor accused of stalling vote - http://t.co/NASrY2F7 #VillaHills #Kentucky	
451	200684700321333248	topix_ky	2012-05-10 16:32	0	#Edgewood #Kentucky	Accused	39.05	-84.56	5km	Point	39.023394	-84.5857771	Kentucky	Thu May 10 20:32:15 +0000 2012	Court: NFL Cheerleader Accused of Sex with Minor Can Sue Website That Called Her 'Slut' - http://t.co/wti7Bkv2 #Edgewood #Kentucky	
452	186210044835147776	topix_ky	2012-03-31 17:55	0	#Edgewood #Kentucky	Accused	39.05	-84.56	5km	Point	39.023394	-84.5857771	Kentucky	Sat Mar 31 21:55:08 +0000 2012	NFL Cheerleader Accused of Sex with Student - http://t.co/dQXPWdaa #Edgewood #Kentucky	
453	164512525117947906	GAPlauche	2012-01-31 19:56	0		Accused	39.05	-84.56	5km	Point	39.0063581	-84.56000305	Houston, TX	Wed Feb 01 00:56:57 +0000 2012	I'm no fan of either, but LOL! RT @gnewburn: . @maddow just accused Romney of insufficient patriotism.	
454	157206726150598656	AThompsonWXIX	2012-01-11 16:06	0		Accused	39.07	-84.44	5km	Point	39.09846279	-84.48824082		Wed Jan 11 21:06:18 +0000 2012	Jury has been given the case against 27 year old Duane Cranmo, accused of a felony - assaulting Newport Police Corp. Larry Long.	
455	157178071370317824	AThompsonWXIX	2012-01-11 14:12	0		Accused	39.07	-84.44	5km	Point	39.09439092	-84.48896805		Wed Jan 11 19:12:27 +0000 2012	Expect closing arguments to begin. Defense called the accused's girlfriend, who corroborated his story. FOX19 will have verdict and reaction	
456	281148650778935297	stevekemple	2012-12-18 16:27	1	#weirdinsults	Accused	39.07	-84.47	5km	Point	39.10148467	-84.51250555	Cincinnati	Tue Dec 18 21:27:16 +0000 2012	Was indirectly accused of "only caring about Bob Dylan &amp; Madonna" today. #weirdinsults	
457	260490509557047296	kindberg	2012-10-22 17:19	0		Accused	39.07	-84.47	5km	Point	39.09851526	-84.51594901	Cincinnati, OH USA	Mon Oct 22 21:19:11 +0000 2012	Sad to retweet this   “@CarbonReductive: US elections: Barack Obama accused of 'climate denial' http://t.co/rHYmzqrR”	
458	240811325016645632	nicktriv04	2012-08-29 10:01	0		Accused	39.07	-84.47	5km	Point	39.0972947	-84.5110839		Wed Aug 29 14:01:08 +0000 2012	@c_burch They fail to realize this policy is now disadvantaging the accused...which STILL isn't fair. It's not hard - treat people fairly!	
459	225600049227374593	grapplegabbler	2012-07-18 10:36	0		Accused	39.07	-84.47	5km	Point	39.1015892	-84.5141539	cincinnati	Wed Jul 18 14:36:57 +0000 2012	You mean that thing you accused me of having was where it was supposed to be the whole time?	
460	195233697744683008	45202	2012-04-25 15:31	0		Accused	39.07	-84.47	5km	Point	39.109438	-84.488499	45202	Wed Apr 25 19:31:55 +0000 2012	High school student accused of bringing gun to school http://t.co/if9z0rNR via http://t.co/N8E5O7KP	
461	163113228640071681	45202	2012-01-27 23:16	0		Accused	39.07	-84.47	5km	Point	39.109438	-84.488499	45202	Sat Jan 28 04:16:38 +0000 2012	Bond Raised For Man Accused in Murder of Walnut Hills Man http://t.co/No1YAYHS via http://t.co/N8E5O7KP	
462	264418701657387009	cassandra_anne	2012-11-02 13:28	1		Accused	39.07	-84.5	5km	Point	39.10356267	-84.53138527	Greensboro, NC	Fri Nov 02 17:28:25 +0000 2012	I was just accused of truancy. TWENTY SEVEN. I AM TWENTY SEVEN PEOPLE!!!!	
463	157128215197003776	AThompsonWXIX	2012-01-11 10:54	0		Accused	39.07	-84.5	5km	Point	39.10984883	-84.51514854		Wed Jan 11 15:54:20 +0000 2012	Prosecution rested in case against Duane Cranmo, accused of assaulting a Newport police officer. Defense presenting its first witness.	
464	189341047648817153	45205	2012-04-09 09:16	0		Accused	39.07	-84.56	5km	Point	39.110361	-84.577335	45205	Mon Apr 09 13:16:38 +0000 2012	West Price Hill Woman Accused in Easter Day Stabbing http://t.co/nMYLzajJ via http://t.co/ZrHui6EN	
465	189341046696710144	45204	2012-04-09 09:16	0		Accused	39.07	-84.56	5km	Point	39.09917	-84.58793	45204	Mon Apr 09 13:16:37 +0000 2012	West Price Hill Woman Accused in Easter Day Stabbing http://t.co/b9j5k0HO via http://t.co/Jns9DUPA	
466	164805150660239360	45205	2012-02-01 15:19	0		Accused	39.07	-84.56	5km	Point	39.110361	-84.577335	45205	Wed Feb 01 20:19:44 +0000 2012	Woman accused of setting apartment fire http://t.co/ppo9ug7y via http://t.co/ZrHui6EN	
467	164805148852498433	45204	2012-02-01 15:19	0		Accused	39.07	-84.56	5km	Point	39.09917	-84.58793	45204	Wed Feb 01 20:19:44 +0000 2012	Woman accused of setting apartment fire http://t.co/2htUCvkv via http://t.co/Jns9DUPA	
468	162720935705722880	45204	2012-01-26 21:17	0		Accused	39.07	-84.56	5km	Point	39.09917	-84.58793	45204	Fri Jan 27 02:17:48 +0000 2012	Ludlow Day Care Worker Accused of Taping Toddler To Floor http://t.co/q8OhbUZ7 via http://t.co/Jns9DUPA	
469	189341048647073793	45238	2012-04-09 09:16	0		Accused	39.07	-84.59	5km	Point	39.110006	-84.607442	45238	Mon Apr 09 13:16:38 +0000 2012	West Price Hill Woman Accused in Easter Day Stabbing http://t.co/4rCySQ2v via http://t.co/1BofdjTe	
470	180922801782403072	45238	2012-03-17 03:45	0		Accused	39.07	-84.59	5km	Point	39.110006	-84.607442	45238	Sat Mar 17 07:45:31 +0000 2012	Accused soldier has local ties http://t.co/P497eI8F via http://t.co/1BofdjTe	
471	174256988740530176	45238	2012-02-27 17:17	0		Accused	39.07	-84.59	5km	Point	39.110006	-84.607442	45238	Mon Feb 27 22:17:58 +0000 2012	Man Accused of Videotaping Woman in Shower Is No Show For Court http://t.co/3QQUIMF4 via http://t.co/1BofdjTe	
472	164805156674871296	45238	2012-02-01 15:19	0		Accused	39.07	-84.59	5km	Point	39.110006	-84.607442	45238	Wed Feb 01 20:19:45 +0000 2012	Woman accused of setting apartment fire http://t.co/6e8Z9tCs via http://t.co/1BofdjTe	
473	180922801451057152	45233	2012-03-17 03:45	0		Accused	39.07	-84.65	5km	Point	39.109756	-84.667826	45233	Sat Mar 17 07:45:31 +0000 2012	Accused soldier has local ties http://t.co/ZXhNUCJv via http://t.co/i4XyaW5W	
474	174256988077817858	45233	2012-02-27 17:17	0		Accused	39.07	-84.65	5km	Point	39.109756	-84.667826	45233	Mon Feb 27 22:17:58 +0000 2012	Man Accused of Videotaping Woman in Shower Is No Show For Court http://t.co/IRBmXr6O via http://t.co/i4XyaW5W	
475	221125968356589569	Jnati513	2012-07-06 02:18	1		Accused	39.09	-84.35	5km	Point	39.10859268	-84.29108999	cincinnati ohio 	Fri Jul 06 06:18:33 +0000 2012	My parents accused me of being a liar. I looked them in the face &amp; said, “tooth fairy, Santa, Easter bunny.” &amp; walked away like a boss.	
476	267985387455139841	TheRealJeffRuby	2012-11-12 08:41	0		Accused	39.09	-84.41	5km	Point	39.12088985	-84.44664296	cincinnati usa	Mon Nov 12 13:41:09 +0000 2012	@DRWhoDey FIRST TIME I'VE EVER ACCUSED REFS OF THAT. I KNOW MANY OF THESE REFS.  GOOD MEN.	
477	204762168044961792	mzlo513	2012-05-21 22:34	0		Accused	39.09	-84.47	5km	Point	39.1150412	-84.5229284	cincinnati,ohio	Tue May 22 02:34:39 +0000 2012	A girl a grew up with is being held in the justice center tonight... Wat she is accused of .... I have NOOO words, jus SMH speechless	
478	195233684188700672	45206	2012-04-25 15:31	0		Accused	39.09	-84.47	5km	Point	39.127052	-84.482707	45206	Wed Apr 25 19:31:52 +0000 2012	High school student accused of bringing gun to school http://t.co/PYgIP9wT via http://t.co/t0PXJ4zx	
479	171720000925728768	45206	2012-02-20 17:16	0		Accused	39.09	-84.47	5km	Point	39.127052	-84.482707	45206	Mon Feb 20 22:16:53 +0000 2012	Man accused of trying to scrap traffic sign http://t.co/l0mSSseJ via http://t.co/t0PXJ4zx	
480	163147195091140608	45206	2012-01-28 01:31	0		Accused	39.09	-84.47	5km	Point	39.127052	-84.482707	45206	Sat Jan 28 06:31:37 +0000 2012	Bond Raised For Man Accused in Murder of Walnut Hills Man http://t.co/pWdBeVIT via http://t.co/t0PXJ4zx	
481	252460376342532097	topix_oh	2012-09-30 13:30	0	#Cincinnati #Ohio	Accused	39.09	-84.5	5km	Point	39.1248504	-84.5202051	Cleveland, OH	Sun Sep 30 17:30:18 +0000 2012	Teen accused of robbery near UC - http://t.co/GrC60zsG #Cincinnati #Ohio	
482	201860672814977026	StewieGilchrist	2012-05-13 22:25	0		Accused	39.09	-84.5	5km	Point	39.126209	-84.532466	Columbus - Cincy	Mon May 14 02:25:09 +0000 2012	Ugh RT @FOX19: UC basketball players accused of assaulting night club bouncer http://t.co/pjmSsOum	
483	189341047871127553	45214	2012-04-09 09:16	0		Accused	39.09	-84.53	5km	Point	39.120405	-84.548681	45214	Mon Apr 09 13:16:38 +0000 2012	West Price Hill Woman Accused in Easter Day Stabbing http://t.co/4nDprXGa via http://t.co/8lQkNFJI	
484	164805153743060992	45214	2012-02-01 15:19	0		Accused	39.09	-84.53	5km	Point	39.120405	-84.548681	45214	Wed Feb 01 20:19:45 +0000 2012	Woman accused of setting apartment fire http://t.co/9ARvpYRa via http://t.co/8lQkNFJI	
485	233593778739507201	FreedomRedux	2012-08-09 12:01	0		Accused	39.11	-84.38	5km	Point	39.1438265	-84.4026538	New Richmond, OH	Thu Aug 09 16:01:11 +0000 2012	Obama campaign aide accused of lying over anti-Romney ad, ties to steelworker, http://t.co/5lS9WfzY - Sent via the FOX News Android App.	
486	269202396540968961	45208	2012-11-15 17:17	0		Accused	39.11	-84.41	5km	Point	39.13687	-84.434934	45208	Thu Nov 15 22:17:07 +0000 2012	Police release sketch of man accused of flashing joggers http://t.co/tc3vU2Yl via http://t.co/mobTjozr	
487	238060931907727360	nicktriv04	2012-08-21 19:52	0		Accused	39.11	-84.41	5km	Point	39.13725858	-84.44317979		Tue Aug 21 23:52:03 +0000 2012	@mcmurrayjt Just bc you were unfair to accusers before doesn't make it okay to be (potentially) unfair to accused now.	
488	193689759346987011	45208	2012-04-21 09:16	0		Accused	39.11	-84.41	5km	Point	39.13687	-84.434934	45208	Sat Apr 21 13:16:51 +0000 2012	Jean-Robert de Cavel accused of impaired driving http://t.co/tOCNAPOw via http://t.co/mobXQYIB	
489	184856966806519808	45208	2012-03-28 00:18	0		Accused	39.11	-84.41	5km	Point	39.13687	-84.434934	45208	Wed Mar 28 04:18:30 +0000 2012	Wife defends soldier accused in Afghan rampage http://t.co/dtAaU9DA via http://t.co/mobXQYIB	
490	181825161077587968	45208	2012-03-19 15:31	0		Accused	39.11	-84.41	5km	Point	39.13687	-84.434934	45208	Mon Mar 19 19:31:11 +0000 2012	Sgt. Robert Bales, accused in Afghan killings, grew up in Norwood http://t.co/aApklwzD via http://t.co/mobXQYIB	
491	181160657125773313	45208	2012-03-17 19:30	0		Accused	39.11	-84.41	5km	Point	39.13687	-84.434934	45208	Sat Mar 17 23:30:41 +0000 2012	Soldier accused in Afghan killings was family man, Cincinnati-area acquaintances say http://t.co/EEsgnOSD via http://t.co/mobXQYIB	
492	181160650037407745	45208	2012-03-17 19:30	0		Accused	39.11	-84.41	5km	Point	39.13687	-84.434934	45208	Sat Mar 17 23:30:39 +0000 2012	Accused soldier recalled in Ohio as genial star http://t.co/YLRx2dPA via http://t.co/mobXQYIB	
493	180922798879948800	45208	2012-03-17 03:45	0		Accused	39.11	-84.41	5km	Point	39.13687	-84.434934	45208	Sat Mar 17 07:45:31 +0000 2012	Accused soldier has local ties http://t.co/OQYwS8ND via http://t.co/mobXQYIB	
494	171663317444726784	45208	2012-02-20 13:31	0		Accused	39.11	-84.41	5km	Point	39.13687	-84.434934	45208	Mon Feb 20 18:31:38 +0000 2012	Man accused of trying to scrap traffic sign http://t.co/Ycsf0AsJ via http://t.co/mobXQYIB	
495	186918307843158016	yatown_news	2012-04-02 16:49	0	#MontgomeryHeights #Cincinnati #OH	Accused	39.11	-84.44	5km	Point	39.142503	-84.471285	Silicon Valley	Mon Apr 02 20:49:32 +0000 2012	Man accused of killing his mother goes on trial -Dayton Daily News (blog) http://t.co/H4OQ8ZnF #MontgomeryHeights #Cincinnati #OH	
496	171689954383110145	45207	2012-02-20 15:17	0		Accused	39.11	-84.44	5km	Point	39.14538	-84.468998	45207	Mon Feb 20 20:17:29 +0000 2012	Man accused of trying to scrap traffic sign http://t.co/D0b6ORFr via http://t.co/VZfTCUsw	
497	181997246232014848	topix_oh	2012-03-20 02:54	0	#Dayton #Ohio	Accused	39.11	-84.47	5km	Point	39.154528	-84.46446	Cleveland, OH	Tue Mar 20 06:54:59 +0000 2012	Friends recall soldier accused in Afghanistan massacre as caring, protective - http://t.co/tssSo0yM #Dayton #Ohio	
498	171720003895308288	45229	2012-02-20 17:16	0		Accused	39.11	-84.47	5km	Point	39.153504	-84.485512	45229	Mon Feb 20 22:16:53 +0000 2012	Man accused of trying to scrap traffic sign http://t.co/VhNq6lGP via http://t.co/m6zIUvC4	
499	200688209984897025	yatown_news	2012-05-10 16:46	0	#ArlingtonHeights #Cincinnati #OH	Accused	39.11	-84.5	5km	Point	39.1453	-84.538336	Silicon Valley	Thu May 10 20:46:12 +0000 2012	Man Now Accused of Threatening To Kill Child During Robbery -WKRC TV Cincinnati http://t.co/Ahh5jCMl #ArlingtonHeights #Cincinnati #OH	
500	160066864343560192	45220	2012-01-19 13:31	0		Accused	39.11	-84.5	5km	Point	39.147425	-84.520238	45220	Thu Jan 19 18:31:29 +0000 2012	Burlington Man Accused of Threatening Woman During Walk http://t.co/5yInpNDW via http://t.co/4DZcANrh	
501	181118871959375872	yatown_news	2012-03-17 16:44	0	#WerkPlace #Cincinnati #OH	Accused	39.11	-84.56	5km	Point	39.140161	-84.59595	Silicon Valley	Sat Mar 17 20:44:38 +0000 2012	Accused soldier recalled as genial star -WDTN http://t.co/WJQoXKXE #WerkPlace #Cincinnati #OH	
502	259412992943333377	Ninaaaaa_14	2012-10-19 17:57	0	#youreugly	Accused	39.11	-84.62	5km	Point	39.15252154	-84.63227072	CinciNASTY, OH	Fri Oct 19 21:57:31 +0000 2012	And got your whole schedule changed because you accused me of putting gum on your seat. But now you're bitching about me. Lol #youreugly	
503	234390022604857344	yatown_news	2012-08-11 16:45	0	#IndianHill #Cincinnati #OH	Accused	39.13	-84.35	5km	Point	39.160627	-84.347352	Silicon Valley	Sat Aug 11 20:45:10 +0000 2012	Covington Babysitter Accused of Stealing From Families -WKRC TV Cincinnati http://t.co/pQBzeOXt #IndianHill #Cincinnati #OH	
504	225280519649239040	KamChance	2012-07-17 13:27	0	#Bengals	Accused	39.13	-84.35	5km	Point	39.1590239	-84.3144459		Tue Jul 17 17:27:16 +0000 2012	Glad #Bengals ain't draft that bum RT @ProFootballTalk: Dez Bryant accused of grabbing his mom by (cont) http://t.co/IEezQWy	
505	200405339923951616	topix_oh	2012-05-09 22:02	0	#TerracePark #Ohio	Accused	39.13	-84.35	5km	Point	39.160803	-84.31404	Cleveland, OH	Thu May 10 02:02:11 +0000 2012	Indian Hill Man Accused of Selling Mushrooms To Terrace Park Teen - http://t.co/ua18LxdZ #TerracePark #Ohio	
506	193689759871287297	45227	2012-04-21 09:16	0		Accused	39.13	-84.35	5km	Point	39.159187	-84.372066	45227	Sat Apr 21 13:16:51 +0000 2012	Jean-Robert de Cavel accused of impaired driving http://t.co/wuDBsXBX via http://t.co/jgUZZgS7	
507	184856968853331968	45212	2012-03-28 00:18	0		Accused	39.13	-84.41	5km	Point	39.16372	-84.452407	45212	Wed Mar 28 04:18:30 +0000 2012	Wife defends soldier accused in Afghan rampage http://t.co/cHrkFMjn via http://t.co/ezsH5G8F	
