TweetID	ID	Username	DateTime	Retweets	Hashtag	Concept	Latitud	Longitud	Radius	TypeCoordinatesLocation	Real Latitud	Real Longitud	Reported location by User	created_at	text	
1	252974304285835264	StephanieTy90	2012-10-01 23:32	0		Crime	39.05	-84.35	5km	Point	39.08324234	-84.36770246	In My Skin	Tue Oct 02 03:32:28 +0000 2012	That would be a crime I wouldn't mind committing	
2	215053084148240385	MRovito	2012-06-19 08:07	0		Crime	39.05	-84.35	5km	Point	39.06441247	-84.30700514	Burlington, VT	Tue Jun 19 12:07:05 +0000 2012	At the crime scene LOL	
3	281453183388229633	_y3ti_	2012-12-19 12:37	0		Crime	39.05	-84.38	5km	Point	39.05323029	-84.44364166	Fort Thomas, KY	Wed Dec 19 17:37:22 +0000 2012	Switzerland doesn't even record crime rates bc they are so low. What country has laws so ALL adults own at least 1 firearm?? Switzerland.	
4	202743080825270272	Cincy_Crime	2012-05-16 08:51	0		Crime	39.05	-84.38	5km	Point	39.0637975	-84.423983	Cincinnati, OH	Wed May 16 12:51:31 +0000 2012	Other on 59XX LINNEMAN STREET, Cincinnati, OH (via http://t.co/oCI1MnMS): Calls For Service-Other http://t.co/fFMqZhPm	
5	190215725976268801	Smoked_Outtt	2012-04-11 19:12	0		Crime	39.05	-84.38	5km	Point	39.04547533	-84.42314364	Cincinnati	Wed Apr 11 23:12:17 +0000 2012	Damn it must be a crime just to feel this good	
6	271433709083848705	emily_sueee	2012-11-21 21:03	0		Crime	39.05	-84.41	5km	Point	39.0705124	-84.44970436	chasing the golden hour	Thu Nov 22 02:03:33 +0000 2012	missing my best friend/partner and crime tonight. don't worry I will take lots of shots for you and do our chant in your honor! @RobinCrail	
7	237944879064420352	Mgk2124	2012-08-21 12:10	0	#TFM	Crime	39.05	-84.41	5km	Point	39.03163682	-84.46514863	Northern Kentucky	Tue Aug 21 16:10:54 +0000 2012	Giving my race, gender, and crime class a connected young white males perspective on things. #TFM	
8	165851313593262082	Kntallon56	2012-02-04 12:36	0	#theotherguys	Crime	39.05	-84.41	5km	Point	39.02786593	-84.45816774		Sat Feb 04 17:36:49 +0000 2012	At the crime scene LOL.. Good tweet #theotherguys	
9	277163677193469952	harrison_bigney	2012-12-07 16:32	0	#StoryOfOurLives	Crime	39.05	-84.44	5km	Point	39.04874224	-84.50312877	Cincinnati, OH	Fri Dec 07 21:32:24 +0000 2012	“@Alex_J_C: I wanted to kill the sexiest person alive......but suicide is a crime.” #StoryOfOurLives	
10	283107263051354114	JCraigKY	2012-12-24 02:10	0		Crime	39.05	-84.47	5km	Point	39.04877623	-84.5101366	USA	Mon Dec 24 07:10:06 +0000 2012	@Wouter567 Tons!! It's no secret unless you listen to Piers Morgan. UK has worst violent crime in the EU. All with no damn guns! No thanks.	
11	283102337994743809	JCraigKY	2012-12-24 01:50	0		Crime	39.05	-84.47	5km	Point	39.04879524	-84.51009642	USA	Mon Dec 24 06:50:31 +0000 2012	.@Wouter567 Also, the UK has 10X the violent crime rate as we do and they have no guns!Again, it isn't the gun dude, it's the evil behind it	
12	283101476019113984	JCraigKY	2012-12-24 01:47	0		Crime	39.05	-84.47	5km	Point	39.04871747	-84.5101126	USA	Mon Dec 24 06:47:06 +0000 2012	@Wouter567 Disagree all you want. Can't change the facts or American rights. Guns protect people. Areas w/high ownership have lower crime!	
13	283098950616109056	JCraigKY	2012-12-24 01:37	1		Crime	39.05	-84.47	5km	Point	39.0487174	-84.51011274	USA	Mon Dec 24 06:37:04 +0000 2012	.@taipow @moira1987 U do realize Chicago &amp; DC have the strictest gun control, but highest crime right? No AR's? Yeah &amp; criminals obey laws..	
14	283004133362003970	JCraigKY	2012-12-23 19:20	0	#TruthHurts #NRA #tcot	Crime	39.05	-84.47	5km	Point	39.04877237	-84.51016213	USA	Mon Dec 24 00:20:18 +0000 2012	Calm down w/ the facts &amp; common sense would ya? MT “@ShaneWright22: More guns = Less crime and safer neighborhoods, #TruthHurts #NRA #tcot”	
15	281920714662113281	JCraigKY	2012-12-20 19:35	0		Crime	39.05	-84.47	5km	Point	39.04876484	-84.51017058	USA	Fri Dec 21 00:35:10 +0000 2012	@piersmorgan My watch displays the time as 7:35pm Est &amp; you are still an idiot. Also, check the violent crime rates in UK you pompous ass!	
16	275130158850138113	margaretmcb	2012-12-02 01:51	0		Crime	39.05	-84.47	5km	Point	39.0909536	-84.49316128	OHIO | KENTUCKY	Sun Dec 02 06:51:56 +0000 2012	I &lt;3 arguing with police dispatch when I'm simply trying to call and report a crime ! Awesome go team	
17	274200579801219072	G_PaidForIt	2012-11-29 12:18	0	#GetYoOwnShit	Crime	39.05	-84.47	5km	Point	39.07596902	-84.50225363	NKY	Thu Nov 29 17:18:07 +0000 2012	I Have Too Vent Bout That Same Shit Alot ! Cause the Same Crime Is Being Committed Again And Again ! #GetYoOwnShit	
18	272894337711501313	G_PaidForIt	2012-11-25 21:47	0	#TheFckkery	Crime	39.05	-84.47	5km	Point	39.07596215	-84.50216261	NKY	Mon Nov 26 02:47:34 +0000 2012	I Hold Grudges Because If I Don't Then I End Up Forgiving a Mafckka Even When They Commit A Crime Towards Me ! 
#TheFckkery !	
19	270085753982308352	JCraigKY	2012-11-18 03:47	0		Crime	39.05	-84.47	5km	Point	39.04874714	-84.51012301	USA	Sun Nov 18 08:47:16 +0000 2012	@Wouter567 Haha she's my partner-in-crime on here! And her being a Dubya admirer is a bonus. Gotta love a hot witty 'W' supportin' chick!	
20	264571540471967745	Mollyodonnell	2012-11-02 23:35	0		Crime	39.05	-84.47	5km	Point	39.07193982	-84.50260775		Sat Nov 03 03:35:45 +0000 2012	Re my partner in crime ! She was my get away car	
21	279785615493570560	ja_frazier15	2012-12-14 22:11	0		Crime	39.05	-84.5	5km	Point	39.08324105	-84.51749759		Sat Dec 15 03:11:03 +0000 2012	@MMFlint so the fact that the cities / states with the strictest gun laws also have the highest gun crime rates means nothing to you?	
22	228707946446610432	mantis_taboggin	2012-07-27 00:26	1		Crime	39.05	-84.5	5km	Point	39.04006301	-84.55365893	Ludlow, KY	Fri Jul 27 04:26:38 +0000 2012	At the crime scene lol	
23	193342647505661953	MKBowersLaw	2012-04-20 10:17	0	#natewebster	Crime	39.05	-84.5	5km	Point	39.0943292	-84.5101555	Columbus, Ohio	Fri Apr 20 14:17:33 +0000 2012	Investigating a 2-yr-old crime - no physical (dna, forensic) evidence. Makes for a difficult case for state. #natewebster	
24	188361500669386752	yatown_news	2012-04-06 16:24	0	#Ludlow #Covington #KY	Crime	39.05	-84.5	5km	Point	39.05906	-84.542748	Silicon Valley	Fri Apr 06 20:24:16 +0000 2012	Arrest made one day after Crescent Springs bank robbery | Crime -FOX19 http://t.co/YIzTdlq7 #Ludlow #Covington #KY	
25	166716355607932928	yatown_news	2012-02-06 21:54	0	#LatoniaTerrace #Covington #KY	Crime	39.05	-84.5	5km	Point	39.05906	-84.542748	Silicon Valley	Tue Feb 07 02:54:11 +0000 2012	Suspected bank robber in custody two months after crime -kypost.com http://t.co/p4KVA1wB #LatoniaTerrace #Covington #KY	
26	236671040078614528	UncleT62	2012-08-17 23:49	0	#FunnyShit	Crime	39.05	-84.53	5km	Point	39.06372644	-84.59093878	Lexington, KY	Sat Aug 18 03:49:07 +0000 2012	@B3Lawdawg Verdict means..... @ukcornett How could commit to this heinous crime?   @BigAl388 #FunnyShit @jhaharlan @psycho_logist34	
27	209301586948796416	amanifashion	2012-06-03 11:12	5		Crime	39.05	-84.53	5km	Point	39.06865544	-84.57410716		Sun Jun 03 15:12:41 +0000 2012	What I hate most about Twitter: finishing a good tweet, having -1 characters left, and then having to decide which grammar crime to commit.	
28	271687713604907008	amberknolle14	2012-11-22 13:52	1	#ThingsImThankfulFor #besfriend	Crime	39.05	-84.56	5km	Point	39.08927613	-84.59094275	cincinnati	Thu Nov 22 18:52:53 +0000 2012	#ThingsImThankfulFor @No_Haarm_NoFoul I text him all day everyday and I wouldn't have it any other way. He's my partner in crime #besfriend	
29	261561081149935616	mikestamper04	2012-10-25 16:13	0		Crime	39.05	-84.56	5km	Point	39.04804321	-84.62004745	crittenden ky	Thu Oct 25 20:13:15 +0000 2012	@BarackObama: President Obama: “Rape is rape. It is a crime.” http://t.co/UCGIjJgZ	
30	212862033312485377	Cincy_Crime	2012-06-13 07:00	0		Crime	39.05	-84.56	5km	Point	39.090009	-84.56782	Cincinnati, OH	Wed Jun 13 11:00:38 +0000 2012	Other on 6XX STEINER STREET, Cincinnati, OH (via http://t.co/oCHXeNDI): Calls For Service-Other http://t.co/Qb15tPWF	
31	182424889741934592	Cincy_Crime	2012-03-21 07:14	0		Crime	39.05	-84.56	5km	Point	39.089965	-84.568002	Cincinnati, OH	Wed Mar 21 11:14:17 +0000 2012	Assault on 6XX STEINER STREET, Cincinnati, OH (via http://t.co/oCI1MnMS): Calls For Service-FIGHT IN PROGRESS http://t.co/rNwwwIMk	
32	182424886935957505	Cincy_Crime	2012-03-21 07:14	0		Crime	39.05	-84.56	5km	Point	39.089965	-84.568002	Cincinnati, OH	Wed Mar 21 11:14:16 +0000 2012	Other on 6XX STEINER STREET, Cincinnati, OH (via http://t.co/oCI1MnMS): Calls For Service-DISORDERLY PERSON(S) http://t.co/EElYllyZ	
33	281539885595250688	cincifan91	2012-12-19 18:21	0		Crime	39.05	-84.59	5km	Point	39.09138611	-84.60428084		Wed Dec 19 23:21:54 +0000 2012	@TheBubbleBubble Chicago has a horrible crime rate, and some of the strictest gun laws.	
34	281539625565159425	cincifan91	2012-12-19 18:20	0		Crime	39.05	-84.59	5km	Point	39.09141905	-84.60417657		Wed Dec 19 23:20:52 +0000 2012	@TheBubbleBubble like you said before, it's cultural. Japan has has a low crime rate for a long time, and America has always had a high one	
35	262153886465404928	JustMeDusty	2012-10-27 07:28	0		Crime	39.05	-84.59	5km	Point	39.04539643	-84.62992397	Kentucky	Sat Oct 27 11:28:51 +0000 2012	@hemantmehta Republicans make awful artists for the most part.  Clone tool abuse... Really Mitt?  Capital digital art crime.	
36	246716282622328832	wellinghoffa_	2012-09-14 17:05	1		Crime	39.05	-84.59	5km	Point	39.08863421	-84.59852868	hoggy warty hogwarts	Fri Sep 14 21:05:20 +0000 2012	heres to the nights i cared to the night ya left ill pour you a drink and toast to the end heres the scene of the crime left me here to die.	
37	215811713742802945	siffordk1	2012-06-21 10:21	0		Crime	39.05	-84.59	5km	Point	39.02460071	-84.61744691	Cincinnati OH	Thu Jun 21 14:21:36 +0000 2012	Is it a coincidence that on my birthday I have 69 followers!!! Gotta give credit to my partner in crime @jennhtweet	
38	173546874031190016	zeesmeej	2012-02-25 18:16	0		Crime	39.05	-84.62	5km	Point	39.00892382	-84.62190086	Florence, Ky	Sat Feb 25 23:16:13 +0000 2012	@Petesayssup Babe has an addiction it's a crime.	
39	231704702637711360	Cincy_Crime	2012-08-04 06:54	0		Crime	39.07	-84.41	5km	Point	39.110577	-84.422592	Cincinnati, OH	Sat Aug 04 10:54:40 +0000 2012	Burglary on 6XX LUNKEN PARK DRIVE, Cincinnati, OH (via http://t.co/oCHXeNDI): Calls For Service-Burglary http://t.co/l5l4VtPo	
40	278302992820752384	KurlyHeadedFuk5	2012-12-10 19:59	0		Crime	39.07	-84.44	5km	Point	39.098424	-84.4903754	NKY/Cincinnati	Tue Dec 11 00:59:38 +0000 2012	Only got 15 points taken off for our crime scene	
41	278291860059979776	KurlyHeadedFuk5	2012-12-10 19:15	0		Crime	39.07	-84.47	5km	Point	39.1078582	-84.4875159	NKY/Cincinnati	Tue Dec 11 00:15:24 +0000 2012	Doing a crime scene an its crazy hard	
42	253841070213955584	Cincy_Crime	2012-10-04 08:56	0		Crime	39.07	-84.47	5km	Point	39.0985606	-84.520385	Cincinnati, OH	Thu Oct 04 12:56:41 +0000 2012	Other on 3XX W 4TH STREET, Cincinnati, OH (via http://t.co/oCHXeNDI): Calls For Service-Other http://t.co/i8MqGSSj	
43	243693577010544641	Cincy_Crime	2012-09-06 08:54	0		Crime	39.07	-84.47	5km	Point	39.101883	-84.508317	Cincinnati, OH	Thu Sep 06 12:54:11 +0000 2012	Other on 2XX E 5TH STREET, Cincinnati, OH (via http://t.co/oCHXeNDI): Calls For Service-Other http://t.co/IsI3Y3x3	
44	240808298943766528	Cincy_Crime	2012-08-29 09:49	0		Crime	39.07	-84.47	5km	Point	39.1046416	-84.510406	Cincinnati, OH	Wed Aug 29 13:49:07 +0000 2012	Other on 7XX MAIN STREET, Cincinnati, OH (via http://t.co/oCHXeNDI): Calls For Service-Other http://t.co/D5Xga0S3	
45	232167797642387458	MoSokanhe	2012-08-05 13:34	0		Crime	39.07	-84.47	5km	Point	39.09760884	-84.50746433		Sun Aug 05 17:34:51 +0000 2012	It's an absolute crime when someone in their early 20's gets married. You have plenty of time to be married, just enjoy the early years!	
46	228818167076626433	Cincy_Crime	2012-07-27 07:44	0		Crime	39.07	-84.47	5km	Point	39.104018	-84.512921	Cincinnati, OH	Fri Jul 27 11:44:36 +0000 2012	Theft on XX E 7TH STREET, Cincinnati, OH (via http://t.co/oCHXeNDI): Calls For Service-Theft http://t.co/qDe9Sduf	
47	226368936315342848	Mgk2124	2012-07-20 13:32	0	#Aurora	Crime	39.07	-84.47	5km	Point	39.10146572	-84.51286876	Northern Kentucky	Fri Jul 20 17:32:14 +0000 2012	Please pray for all the victims of the senseless crime that took place last night in #Aurora	
48	220637996003762176	c_dejorge	2012-07-04 17:59	0		Crime	39.07	-84.47	5km	Point	39.09808749	-84.5043933	Cincinnati, OH	Wed Jul 04 21:59:32 +0000 2012	@kaynoel__ welllll I'll go with you if you need a partner in crime!	
49	219303454533894144	_johnfrazier	2012-07-01 01:36	0		Crime	39.07	-84.47	5km	Point	39.098441	-84.516396	The Trap	Sun Jul 01 05:36:34 +0000 2012	13th floor of the millennium hotel in cincinnati..able to see the crime before it happens! http://t.co/YUvVNu7n	
50	215429367784943616	Cincy_Crime	2012-06-20 09:02	0		Crime	39.07	-84.47	5km	Point	39.1036587	-84.503375	Cincinnati, OH	Wed Jun 20 13:02:18 +0000 2012	Vandalism on 5XX CULVERT ST, Cincinnati, OH (via http://t.co/oCHXeNDI): Part I Crime-Criminal Damaging/Endangering http://t.co/cXP7z939	
51	205266083790323712	Cincy_Crime	2012-05-23 07:57	0		Crime	39.07	-84.47	5km	Point	39.1021349	-84.506431	Cincinnati, OH	Wed May 23 11:57:02 +0000 2012	Theft on E 5TH STREET, Cincinnati, OH (via http://t.co/oCHXeNDI): Calls For Service-Theft http://t.co/NEB1QaWy	
52	202560642186608641	OlUncleZ	2012-05-15 20:46	0		Crime	39.07	-84.47	5km	Point	39.11027145	-84.49420166	Mt. Adams	Wed May 16 00:46:35 +0000 2012	My partner in crime is sick &amp; needs me. It scares me. Get better my lil' penguin.  @ Ol' Uncle Z's Shack http://t.co/IGDoKJG	
53	200643192117411841	CRPtweets	2012-05-10 13:47	0		Crime	39.07	-84.47	5km	Point	39.0982629	-84.4915539	Indianapolis, IN 	Thu May 10 17:47:19 +0000 2012	Crime In Stereo Is Dead.	
54	185690811059539968	45202	2012-03-30 07:31	0		Crime	39.07	-84.47	5km	Point	39.109438	-84.488499	45202	Fri Mar 30 11:31:53 +0000 2012	Crime Stoppers tip clears cold case http://t.co/1zTCH1gl via http://t.co/N8E5O7KP	
55	179873159477071873	Cincy_Crime	2012-03-14 06:14	0		Crime	39.07	-84.47	5km	Point	39.1011652	-84.51294	Cincinnati, OH	Wed Mar 14 10:14:37 +0000 2012	Burglary on 5XX VINE STREET, Cincinnati, OH (via http://t.co/oCI1MnMS): Calls For Service-NON-RESIDENTIAL BURG http://t.co/BgayzMSA	
56	177791453769109504	anthonyrallo	2012-03-08 11:22	0	#Facebook #SignalPG	Crime	39.07	-84.47	5km	Point	39.10336284	-84.50512921	New York, NY, USA	Thu Mar 08 16:22:40 +0000 2012	"it's a crime that not everyone's on #Facebook " @davidbfischer #SignalPG	
57	174829704308719617	Cincy_Crime	2012-02-29 07:13	0		Crime	39.07	-84.47	5km	Point	39.1026819	-84.51172	Cincinnati, OH	Wed Feb 29 12:13:44 +0000 2012	Other on E 6TH STREET/WALNUT STREET, Cincinnati, OH (via http://t.co/oCI1MnMS): Calls For Service-DISORDERLY PERSON(S) http://t.co/BCuAryBU	
58	165248450722672640	spatterson5	2012-02-02 20:41	0		Crime	39.07	-84.47	5km	Point	39.1029111	-84.51143593		Fri Feb 03 01:41:15 +0000 2012	Back at the scene of the crime! I love this bartender!! (@ nada) http://t.co/jMIyJ7dU	
59	281813670508503041	sirharper	2012-12-20 12:29	0		Crime	39.07	-84.5	5km	Point	39.09524506	-84.52542341		Thu Dec 20 17:29:49 +0000 2012	@katieco60789885 You mean the FBI UCR stats showing violent crime progressively going DOWN over 30 years? With only one recent exception.	
60	280771011799027712	ButtonMonkey	2012-12-17 15:26	0	#cincinnati	Crime	39.07	-84.5	5km	Point	39.10209094	-84.530108	U.S.A.	Mon Dec 17 20:26:40 +0000 2012	Now would e a convenient time to commit a crime in Queensgate. #cincinnati http://t.co/3wF6tdQH	
61	276817503638941696	thelackman	2012-12-06 17:36	0		Crime	39.07	-84.5	5km	Point	39.1093901	-84.515126	Cincinnati, Ohio	Thu Dec 06 22:36:50 +0000 2012	Just added Stone The Perfect Crime Black Saison bottles. See our full beer menu: http://t.co/2yJ4gUSl @beermenus @StoneBrewingCo	
62	274248005450870784	CrimestopperDeb	2012-11-29 15:26	0		Crime	39.07	-84.5	5km	Point	39.1145098	-84.5081438	Cincinnati, Ohio	Thu Nov 29 20:26:34 +0000 2012	Secretive crime fighting society agrees to help solve Boone County double homicide at 6@local12	
63	253840981336674304	Cincy_Crime	2012-10-04 08:56	0		Crime	39.07	-84.5	5km	Point	39.1046733	-84.512183	Cincinnati, OH	Thu Oct 04 12:56:20 +0000 2012	Arrest on E 8TH ST/WALNUT STREET, Cincinnati, OH (via http://t.co/oCHXeNDI): Calls For Service-Arrest http://t.co/2CQYXFZE	
64	250924990520766464	Cincy_Crime	2012-09-26 07:49	0		Crime	39.07	-84.5	5km	Point	39.1043707	-84.520606	Cincinnati, OH	Wed Sep 26 11:49:14 +0000 2012	Other on 4XX W 9TH STREET, Cincinnati, OH (via http://t.co/oCHXeNDI): Calls For Service-Other http://t.co/0AFFKr3p	
65	243693621356924928	Cincy_Crime	2012-09-06 08:54	0		Crime	39.07	-84.5	5km	Point	39.1043506	-84.521583	Cincinnati, OH	Thu Sep 06 12:54:21 +0000 2012	Other on 4XX W 9TH STREET, Cincinnati, OH (via http://t.co/oCHXeNDI): Calls For Service-Other http://t.co/vdGzTXvf	
66	240537467722272768	CrimestopperDeb	2012-08-28 15:52	1		Crime	39.07	-84.5	5km	Point	39.1085268	-84.5066521	Cincinnati, Ohio	Tue Aug 28 19:52:55 +0000 2012	Sex crime frenzy in one neighborhood.  Police may have caught up with a teen just in time at 5:30 @local12	
67	233184514699059200	Cincy_Crime	2012-08-08 08:54	0		Crime	39.07	-84.5	5km	Point	39.1074968	-84.512876	Cincinnati, OH	Wed Aug 08 12:54:55 +0000 2012	Theft on 11XX WALNUT STREET, Cincinnati, OH (via http://t.co/oCHXeNDI): Part I Crime-Theft http://t.co/z4RbAWB9	
68	228817989967941632	Cincy_Crime	2012-07-27 07:43	0		Crime	39.07	-84.5	5km	Point	39.1032809	-84.529571	Cincinnati, OH	Fri Jul 27 11:43:54 +0000 2012	Other on W 8TH ST/LINN STREET, Cincinnati, OH (via http://t.co/oCHXeNDI): Calls For Service-Other http://t.co/5SvhiCoa	
69	224247492823355392	kt_reeder	2012-07-14 17:02	0		Crime	39.07	-84.5	5km	Point	39.10883461	-84.51741457	Cincinnati, OH	Sat Jul 14 21:02:23 +0000 2012	Washington Park, once over-ridden with crime, trash, and homeless, now a wonderful oasis   @ Washington Park http://t.co/mTc9phIo	
70	215429412378775553	Cincy_Crime	2012-06-20 09:02	0		Crime	39.07	-84.5	5km	Point	39.109316	-84.512298	Cincinnati, OH	Wed Jun 20 13:02:29 +0000 2012	Vandalism on 1XX E 13TH ST, Cincinnati, OH (via http://t.co/oCHXeNDI): Part I Crime-Criminal Damaging/Endangering http://t.co/iQFqYUbJ	
71	210451803672805377	smprzygocki	2012-06-06 15:23	0	#radiohead	Crime	39.07	-84.5	5km	Point	39.1112653	-84.51403884	Cincinnati, Ohio	Wed Jun 06 19:23:14 +0000 2012	Many thanks to @Jessika_Nikole &amp; Gabriel Deutsch for being my partners in crime at #radiohead last night &lt;3 even though the show was subpar	
72	205265994942382082	Cincy_Crime	2012-05-23 07:56	0		Crime	39.07	-84.5	5km	Point	39.1104502	-84.524469	Cincinnati, OH	Wed May 23 11:56:41 +0000 2012	Theft on 5XX BETTON STREET, Cincinnati, OH (via http://t.co/oCHXeNDI): Calls For Service-Theft http://t.co/n0RIZdAy	
73	202743257942331393	Cincy_Crime	2012-05-16 08:52	0		Crime	39.07	-84.5	5km	Point	39.1111372	-84.525028	Cincinnati, OH	Wed May 16 12:52:14 +0000 2012	Arrest on 5XX DERRICK TURNBOW AVENUE, Cincinnati, OH (via http://t.co/oCI1MnMS): Calls For Service-Arrest http://t.co/UHVrtbDL	
74	194107508573474816	topix_oh	2012-04-22 12:56	0	#Cincinnati #Ohio	Crime	39.07	-84.5	5km	Point	39.1041656	-84.5189968	Cleveland, OH	Sun Apr 22 16:56:51 +0000 2012	Enquirer in-Depth: Black-on-black crime gets new focus from city leaders - http://t.co/JIlcRFUr #Cincinnati #Ohio	
75	271954680672821249	EMPRYL	2012-11-23 07:33	0		Crime	39.07	-84.53	5km	Point	39.11139538	-84.52679205	West End Cincinnati, Ohio	Fri Nov 23 12:33:43 +0000 2012	@MichaelBlackson on Black Friday dressed in all black = Black on Black crime on a Friday night!!	
76	243693665992728576	Cincy_Crime	2012-09-06 08:54	0		Crime	39.07	-84.53	5km	Point	39.105498	-84.557082	Cincinnati, OH	Thu Sep 06 12:54:32 +0000 2012	Other on W 8TH STREET/MATSON PL, Cincinnati, OH (via http://t.co/oCHXeNDI): Calls For Service-Other http://t.co/XIUIMmew	
77	231342500386840576	Cincy_Crime	2012-08-03 06:55	0		Crime	39.07	-84.53	5km	Point	39.110462	-84.551329	Cincinnati, OH	Fri Aug 03 10:55:24 +0000 2012	Vandalism on 12XX STATE AV, Cincinnati, OH (via http://t.co/oCHXeNDI): Part I Crime-Criminal Damaging/Endangering http://t.co/yt8COz5H	
78	225427789925449728	EMPRYL	2012-07-17 23:12	0		Crime	39.07	-84.53	5km	Point	39.11142075	-84.52722073	West End Cincinnati, Ohio	Wed Jul 18 03:12:28 +0000 2012	I had to tell my lil people's... This ain't the 80's no more!! You can't beat up fags and get away with that shit.. It's a hate crime now!!	
79	210323208442875904	Cincy_Crime	2012-06-06 06:52	0		Crime	39.07	-84.53	5km	Point	39.111553	-84.526831	Cincinnati, OH	Wed Jun 06 10:52:15 +0000 2012	Other on 15XX JONES STREET, Cincinnati, OH (via http://t.co/oCHXeNDI): Calls For Service-Other http://t.co/IcqKnJfs	
80	208165085196206080	Cincy_Crime	2012-05-31 07:56	0		Crime	39.07	-84.53	5km	Point	39.104406	-84.570346	Cincinnati, OH	Thu May 31 11:56:38 +0000 2012	Arrest on 7XX WELLS STREET, Cincinnati, OH (via http://t.co/oCHXeNDI): Calls For Service-Arrest http://t.co/hrZmMDhG	
81	257114304539668480	wellinghoffa_	2012-10-13 09:43	0		Crime	39.07	-84.56	5km	Point	39.09942434	-84.60175766	hoggy warty hogwarts	Sat Oct 13 13:43:21 +0000 2012	its a crime to care nowadays.	
82	253841115030097920	Cincy_Crime	2012-10-04 08:56	0		Crime	39.07	-84.56	5km	Point	39.1100888	-84.565354	Cincinnati, OH	Thu Oct 04 12:56:52 +0000 2012	Arrest on ELBERON AV/WARSAW AVENUE, Cincinnati, OH (via http://t.co/oCHXeNDI): Calls For Service-Arrest http://t.co/0iuZj7PB	
83	253841025787916289	Cincy_Crime	2012-10-04 08:56	0		Crime	39.07	-84.56	5km	Point	39.1098345	-84.560978	Cincinnati, OH	Thu Oct 04 12:56:31 +0000 2012	Other on 30XX WARSAW AVENUE, Cincinnati, OH (via http://t.co/oCHXeNDI): Calls For Service-Other http://t.co/rMs6Xa2b	
84	240808387644895232	Cincy_Crime	2012-08-29 09:49	0		Crime	39.07	-84.56	5km	Point	39.11296	-84.575032	Cincinnati, OH	Wed Aug 29 13:49:28 +0000 2012	Other on ROSS AVENUE/WARSAW AVENUE, Cincinnati, OH (via http://t.co/oCHXeNDI): Calls For Service-Other http://t.co/8xYWBzbz	
85	231704658354245632	Cincy_Crime	2012-08-04 06:54	0		Crime	39.07	-84.56	5km	Point	39.1086238	-84.568631	Cincinnati, OH	Sat Aug 04 10:54:30 +0000 2012	Assault on 9XX FAIRBANKS AVENUE, Cincinnati, OH (via http://t.co/oCHXeNDI): Calls For Service-Assault http://t.co/32zZXqcI	
86	231342633216258048	Cincy_Crime	2012-08-03 06:55	0		Crime	39.07	-84.56	5km	Point	39.1104432	-84.570132	Cincinnati, OH	Fri Aug 03 10:55:56 +0000 2012	Assault on 35XX WARSAW AV, Cincinnati, OH (via http://t.co/oCHXeNDI): Part I Crime-Felonious Assault http://t.co/SsHb4L4Y	
87	225546308608458752	Cincy_Crime	2012-07-18 07:03	0		Crime	39.07	-84.56	5km	Point	39.107182	-84.58861	Cincinnati, OH	Wed Jul 18 11:03:25 +0000 2012	Robbery on 41XX W 8TH STREET, Cincinnati, OH (via http://t.co/oCHXeNDI): Calls For Service-Robbery http://t.co/fxKxvJCH	
88	225443161814728704	zookery	2012-07-18 00:13	1		Crime	39.07	-84.56	5km	Point	39.11205046	-84.55384562	ATL	Wed Jul 18 04:13:32 +0000 2012	Everyone knows you don't get out of the car on a dark and foggy night if you are a character in the first five minutes of a crime show.	
89	223053690230157313	Cincy_Crime	2012-07-11 09:58	0		Crime	39.07	-84.56	5km	Point	39.112131	-84.580672	Cincinnati, OH	Wed Jul 11 13:58:38 +0000 2012	Other on 39XX VINCENT AVENUE, Cincinnati, OH (via http://t.co/oCHXeNDI): Calls For Service-Other http://t.co/XRCLzFSG	
90	217949977836658688	Cincy_Crime	2012-06-27 07:58	0		Crime	39.07	-84.56	5km	Point	39.106496	-84.583481	Cincinnati, OH	Wed Jun 27 11:58:18 +0000 2012	Theft on 7XX ROSEMONT AVENUE, Cincinnati, OH (via http://t.co/oCHXeNDI): Part I Crime-Theft http://t.co/fWQsn6rg	
91	217949933431554048	Cincy_Crime	2012-06-27 07:58	0		Crime	39.07	-84.56	5km	Point	39.106496	-84.583481	Cincinnati, OH	Wed Jun 27 11:58:08 +0000 2012	Burglary on 7XX ROSEMONT AVENUE, Cincinnati, OH (via http://t.co/oCHXeNDI): Part I Crime-Burglary http://t.co/Mj1tKo0f	
92	208165129425129473	Cincy_Crime	2012-05-31 07:56	0		Crime	39.07	-84.56	5km	Point	39.114603	-84.564067	Cincinnati, OH	Thu May 31 11:56:49 +0000 2012	Arrest on 12XX PURCELL AVENUE, Cincinnati, OH (via http://t.co/oCHXeNDI): Calls For Service-Arrest http://t.co/yf5Xsk2w	
93	200271363280338945	Cincy_Crime	2012-05-09 13:09	0		Crime	39.07	-84.56	5km	Point	39.110462	-84.570483	Cincinnati, OH	Wed May 09 17:09:48 +0000 2012	Arrest on MCPHERSON AV/WARSAW AVENUE, Cincinnati, OH (via http://t.co/oCI1MnMS): Calls For Service-Arrest http://t.co/czU8BC8a	
94	190480315737833472	beastyblack78	2012-04-12 12:43	0		Crime	39.07	-84.56	5km	Point	39.11029498	-84.55954723		Thu Apr 12 16:43:40 +0000 2012	Jail niggas klii me they always think that ur time have to stop Cuz there's did u did the crime now fall back and do the time	
95	271014371516375040	45238	2012-11-20 17:17	0		Crime	39.07	-84.59	5km	Point	39.110006	-84.607442	45238	Tue Nov 20 22:17:16 +0000 2012	Pendleton enforcement blitz reduces blight and crime, promotes redevelopment http://t.co/VfXNvf4I via http://t.co/1BoaFJK4	
96	248389487267291137	Cincy_Crime	2012-09-19 07:54	0		Crime	39.07	-84.59	5km	Point	39.112177	-84.596846	Cincinnati, OH	Wed Sep 19 11:54:03 +0000 2012	Other on 47XX DALE AVENUE, Cincinnati, OH (via http://t.co/oCHXeNDI): Calls For Service-Other http://t.co/74aXjr7Y	
97	239721363110232064	ChristinaOh12	2012-08-26 09:50	0		Crime	39.07	-84.59	5km	Point	39.111047	-84.60763771		Sun Aug 26 13:50:01 +0000 2012	Looks like a crime scene in here.	
98	265466317891571712	DiephouseSandra	2012-11-05 09:51	0		Crime	39.07	-84.62	5km	Point	39.10908027	-84.64268429	Sebastian Florida	Mon Nov 05 14:51:16 +0000 2012	@RepBryanCutler This is a crime.	
