12308	279410108268687360	jessicadattilo	2012-12-13 21:18	0	#canthelpit	Fight	39.07	-84.47	5km	Point	39.0975992	-84.5113999		Fri Dec 14 02:18:55 +0000 2012	When I hear any songs, I try and fight the urge not to dance. #canthelpit @morganquatman	
12309	279048722015461376	rish_like_fish	2012-12-12 21:22	0	#bandtrips	Fight	39.07	-84.47	5km	Point	39.099609	-84.507187	Seattle, WA	Thu Dec 13 02:22:54 +0000 2012	So far on this trip we've watched GoodBurger, Bridesmaids, Fight Club, and now the Lion King. #bandtrips	
12310	277867150239215618	papaoilman	2012-12-09 15:07	0		Fight	39.07	-84.47	5km	Point	39.09614421	-84.51353711	39.190875,-84.281509	Sun Dec 09 20:07:45 +0000 2012	It would be nice to be able to see the game, but too many gawkers watching the fight in the lower seats!!!!	
12311	277640227231768577	prolificate	2012-12-09 00:06	0	#welcomeback	Fight	39.07	-84.47	5km	Point	39.10410941	-84.5104599	Eugene, OR	Sun Dec 09 05:06:03 +0000 2012	@LivingInGin I'll fight you for it. The bacon that is... Already got a skillet. #welcomeback	
12312	277597944310546434	_leleleemy	2012-12-08 21:18	1		Fight	39.07	-84.47	5km	Point	39.10299454	-84.50955826		Sun Dec 09 02:18:02 +0000 2012	Round 2 Watching The Fight With My Girls @KelsLoko @Baldhead_Beauty  @ Margaritas http://t.co/ZRZKMGC0	
12313	274504144658767872	AnnaElizabeth_9	2012-11-30 08:24	0		Fight	39.07	-84.47	5km	Point	39.10223934	-84.50737455	Atlanta, GA	Fri Nov 30 13:24:22 +0000 2012	Why we always gotta fight about the same things	
12314	272805008196632576	BradyRindler	2012-11-25 15:52	0	#football #awesome	Fight	39.07	-84.47	5km	Point	39.09484088	-84.5164017		Sun Nov 25 20:52:37 +0000 2012	That was the best fight I have ever seen 😳 #football #awesome	
12315	272804998843355137	LoganM_UC	2012-11-25 15:52	0		Fight	39.07	-84.47	5km	Point	39.09571554	-84.51532393	Cincinnati, OH	Sun Nov 25 20:52:34 +0000 2012	Wow what a fight during the bengals game if your not here you missed out ha	
12316	270618438202957825	TheRealJeffRuby	2012-11-19 15:03	0		Fight	39.07	-84.47	5km	Point	39.10414028	-84.51188274	cincinnati usa	Mon Nov 19 20:03:58 +0000 2012	@TheRealJeffRuby fight	
12317	284651390503092225	Gmcgruder	2012-12-28 08:25	0	#fat	Fight	39.07	-84.5	5km	Point	39.11142992	-84.50356775	ÜT: 39.10906,-84.54695	Fri Dec 28 13:25:54 +0000 2012	After burnt in the gym for 2 hours since 6 I'm whooped..... #fat won't fight itself...	
12318	276931495040528384	thatboyUG	2012-12-07 01:09	0		Fight	39.07	-84.5	5km	Point	39.10573945	-84.51082421	:Cincy/#NKU  	Fri Dec 07 06:09:48 +0000 2012	@TheYoungDuchess niggas wanna fight	
12319	282607597390008320	EMPRYL	2012-12-22 17:04	1		Fight	39.07	-84.53	5km	Point	39.1124258	-84.52548797	West End Cincinnati, Ohio	Sat Dec 22 22:04:36 +0000 2012	These niggas that got fly mouths but can't fight a lick!!!!! lmfao STFU	
12320	276480136491200512	EMPRYL	2012-12-05 19:16	0		Fight	39.07	-84.53	5km	Point	39.11140256	-84.52710983	West End Cincinnati, Ohio	Thu Dec 06 00:16:15 +0000 2012	Man these kids outside so loud... It always sound like they about to fight and shit...	
12321	276143362430627841	EMPRYL	2012-12-04 20:58	0	#shitshilarious	Fight	39.07	-84.53	5km	Point	39.11126375	-84.52724302	West End Cincinnati, Ohio	Wed Dec 05 01:58:02 +0000 2012	lmfao I love the Twix commercial where it show the Twix owners about to fight!!! #shitshilarious	
12322	275619169825849345	selfmade_chrisg	2012-12-03 10:15	0		Fight	39.07	-84.53	5km	Point	39.10255431	-84.56656579	EveryWhere	Mon Dec 03 15:15:05 +0000 2012	I love my Bm we fight and fuss but we get thru everything	
12323	276176164366733312	_baabyfaacee_	2012-12-04 23:08	0	#bed #night	Fight	39.07	-84.56	5km	Point	39.0968685	-84.5893045	cinci	Wed Dec 05 04:08:23 +0000 2012	I hate when my jealousy kicks in .. makes me want to fight every pretty girl i see .. #bed #night	
12324	276174974363004928	_baabyfaacee_	2012-12-04 23:03	0		Fight	39.07	-84.56	5km	Point	39.0968663	-84.5893067	cinci	Wed Dec 05 04:03:39 +0000 2012	I always fight for what i love , so dont fuck with me when it comes to that shit ..	
12325	276166552196370432	_baabyfaacee_	2012-12-04 22:30	0		Fight	39.07	-84.56	5km	Point	39.0968672	-84.5893065	cinci	Wed Dec 05 03:30:11 +0000 2012	All these girls want prince charming . well i don't want to fight with them all over one guy , so that's why i made you my prince charming .	
12326	274975764934443009	_baabyfaacee_	2012-12-01 15:38	0		Fight	39.07	-84.56	5km	Point	39.0984765	-84.6003257	cinci	Sat Dec 01 20:38:25 +0000 2012	For once , i want you to fight for me ..	
12327	273180390666158080	wellinghoffa_	2012-11-26 16:44	0		Fight	39.07	-84.56	5km	Point	39.09904007	-84.60170692	hoggy warty hogwarts	Mon Nov 26 21:44:15 +0000 2012	There was a fight, wut?	
12328	270569808729341952	jessicouchh	2012-11-19 11:50	0		Fight	39.07	-84.56	5km	Point	39.11031882	-84.58560311		Mon Nov 19 16:50:44 +0000 2012	“@eonline: Justin Bieber does not look very happy after his big weekend fight with Selena Gomez http://t.co/RTu74WWz” @emilymansoor	
12329	267251733070245888	cornoisseur	2012-11-10 08:05	0		Fight	39.07	-84.56	5km	Point	39.11172312	-84.55392086	Chicago, Illinois, Earth	Sat Nov 10 13:05:53 +0000 2012	@themikevance pretty BA. Should've yelled freedom. It's time to unite all the clans and fight	
12330	265287271975116800	wellinghoffa_	2012-11-04 21:59	0		Fight	39.07	-84.56	5km	Point	39.09929213	-84.60161002	hoggy warty hogwarts	Mon Nov 05 02:59:49 +0000 2012	YOU'VE GOTTA FIGHT...  FOR YOUR RIGHT...  TO PAAAARTY	
12331	262407352148430849	rmboem	2012-10-28 00:16	0	#noneedtobebitchy	Fight	39.07	-84.56	5km	Point	39.09750883	-84.50970147	where the road meets the sun 	Sun Oct 28 04:16:02 +0000 2012	Waldo on waldo fight #noneedtobebitchy	
12332	282880691249770497	justinheiland	2012-12-23 11:09	0		Fight	39.07	-84.59	5km	Point	39.10502637	-84.6212988		Sun Dec 23 16:09:47 +0000 2012	That fight that brings u just a lil closer then before : @allykelley47 I love u babe	
12333	276462910245584896	BradleyKanter10	2012-12-05 18:07	1	#doglogic	Fight	39.07	-84.59	5km	Point	39.09471155	-84.63813885	Kenwood, OH	Wed Dec 05 23:07:48 +0000 2012	Begs you to throw toy... Puts up a fight when you try to take the toy.... #doglogic	
12334	269118712236343296	meowinara	2012-11-15 11:44	0		Fight	39.07	-84.59	5km	Point	39.09453438	-84.63799674	Lakeside Park, KY	Thu Nov 15 16:44:35 +0000 2012	If you're trying to prove a point or fight with me and put a smile in the text I will personally stab you in the chest 37 times.	
12335	268808432361037825	meowinara	2012-11-14 15:11	2		Fight	39.07	-84.59	5km	Point	39.09454859	-84.6379788	Lakeside Park, KY	Wed Nov 14 20:11:39 +0000 2012	The fight between clay and lee gives my day a meaning	
12336	267029533864116224	IRieger2	2012-11-09 17:22	0		Fight	39.07	-84.59	5km	Point	39.10449842	-84.61538999	West side of cincinnati 	Fri Nov 09 22:22:56 +0000 2012	I swear Tuesday if Vernon says dill or he says he's going to roll me down a hill I'm going to fight him.	
12337	266944458048811008	meowinara	2012-11-09 11:44	0		Fight	39.07	-84.59	5km	Point	39.094907	-84.63996084	Lakeside Park, KY	Fri Nov 09 16:44:53 +0000 2012	My first band tee I ever bought was AFI. Fight me.	
12338	264371023749718016	meowinara	2012-11-02 10:18	0		Fight	39.07	-84.59	5km	Point	39.09575554	-84.64015738	Lakeside Park, KY	Fri Nov 02 14:18:58 +0000 2012	@ClayWanstrath he'll fight you	
12339	253144374941188096	IWasBorn2MakeIt	2012-10-02 10:48	0		Fight	39.07	-84.59	5km	Point	39.09544667	-84.63970107	cincinnati	Tue Oct 02 14:48:16 +0000 2012	Females fight 1on1 all the time	
12340	245719340471681024	meowinara	2012-09-11 23:03	0		Fight	39.07	-84.59	5km	Point	39.09449052	-84.63802743	Lakeside Park, KY	Wed Sep 12 03:03:50 +0000 2012	@ShamelessLeo because I want to brag to people that I dated a guy with a tattoo of pillows having a people fight	
12341	245718258500632577	meowinara	2012-09-11 22:59	0	#ifwearedating	Fight	39.07	-84.59	5km	Point	39.0944837	-84.63802226	Lakeside Park, KY	Wed Sep 12 02:59:32 +0000 2012	#ifwearedating don't get a tattoo of pillows having a people fight on your leg	
12342	243902718048088064	LUV_RALFIEL31	2012-09-06 22:45	0		Fight	39.07	-84.59	5km	Point	39.10402206	-84.55304366	cincinnati ohio	Fri Sep 07 02:45:14 +0000 2012	No one should have too fight for a job nor fight to keep a roof over your head ... !! IN THE WORDS OF OBAMA ... !!	
12343	242457616343760897	MacyMcCoy1	2012-09-02 23:02	0	#startingtonotcare	Fight	39.07	-84.59	5km	Point	39.11214352	-84.61295486		Mon Sep 03 03:02:55 +0000 2012	I don’t want to fight to be understood anymore. #startingtonotcare	
12344	241169963619069952	meowinara	2012-08-30 09:46	0		Fight	39.07	-84.59	5km	Point	39.09562811	-84.63997375	Lakeside Park, KY	Thu Aug 30 13:46:14 +0000 2012	@ShamelessLeo wake up I wanna have a twitter fight	
12345	241169870966890496	meowinara	2012-08-30 09:45	0		Fight	39.07	-84.59	5km	Point	39.09562811	-84.63997375	Lakeside Park, KY	Thu Aug 30 13:45:52 +0000 2012	That was a very boring twitter fight.	
12346	237739539832131584	H2Owens	2012-08-20 22:34	0	#hardcore	Fight	39.07	-84.59	5km	Point	39.1062304	-84.5890295	Cincinnati OH	Tue Aug 21 02:34:57 +0000 2012	@HellenaHeavenly look at you and all your tweeting...you wanna fight? Lol #hardcore	
12347	283095362988806144	Twist_Burr	2012-12-24 01:22	0		Fight	39.07	-84.62	5km	Point	39.11230775	-84.61280905	Trapped in an oil painting	Mon Dec 24 06:22:48 +0000 2012	BET Y'ALL DON'T FIGHT THO.	
12348	274189742621483008	IWasBorn2MakeIt	2012-11-29 11:35	0		Fight	39.07	-84.62	5km	Point	39.0989282	-84.6537402	cincinnati	Thu Nov 29 16:35:03 +0000 2012	Wtf we gone do fight over y'all opinion	
12349	264373094062370816	meowinara	2012-11-02 10:27	0		Fight	39.07	-84.62	5km	Point	39.09677944	-84.65129477	Lakeside Park, KY	Fri Nov 02 14:27:12 +0000 2012	@ClayWanstrath wants to fight my grandpa );	
12350	263697254664269824	meowinara	2012-10-31 13:41	0		Fight	39.07	-84.62	5km	Point	39.10330904	-84.64377133	Lakeside Park, KY	Wed Oct 31 17:41:39 +0000 2012	@BradMeetsWorld I'll fight you	
12351	251039183290908672	djburke5	2012-09-26 15:23	0		Fight	39.07	-84.62	5km	Point	39.1121031	-84.6227761		Wed Sep 26 19:23:00 +0000 2012	@DaJordanRiver: @JakeNiehaus3 @sam_kwiatkowski @nbeard32 @djburke5 @johnnylane_  oh and fight? Is that what they teach you? Just stop..	
12352	236291286758457344	H2Owens	2012-08-16 22:40	0	#warwrestling #oneclassybroad	Fight	39.07	-84.62	5km	Point	39.106252	-84.5890345	Cincinnati OH	Fri Aug 17 02:40:07 +0000 2012	&lt;&lt;&lt;going to Lima, Ohio tomorrow to fight faces for #warwrestling. Time to prove a point! #oneclassybroad	
12353	282270672581980160	Swaggie_2_Dope	2012-12-21 18:45	0		Fight	39.07	-84.65	5km	Point	39.0789874	-84.7014078	Cincinnati 	Fri Dec 21 23:45:47 +0000 2012	@whaddupbop @ICExKING u won't fight me	
12354	240848808202878977	meowinara	2012-08-29 12:30	0		Fight	39.07	-84.65	5km	Point	39.11225443	-84.65173234	Lakeside Park, KY	Wed Aug 29 16:30:05 +0000 2012	@schnor_schnor fight me	
12355	171439558393733122	Zach_Wagner11	2012-02-19 22:42	0		Fight	39.07	-84.65	5km	Point	39.08781603	-84.59782554	cincinnati	Mon Feb 20 03:42:30 +0000 2012	If u know your about to get your ass kicked take your pants off no one wants to fight a naked guy	
12356	274265236264079362	EGYPTIANBRATT	2012-11-29 16:35	0		Fight	39.09	-84.35	5km	Point	39.10812462	-84.30341603		Thu Nov 29 21:35:02 +0000 2012	Only got one hour of sleep, n still manage not to fight with malique.. Surprisingly, cuz he starts it!	
12357	233790106211848192	POPE_isdope	2012-08-10 01:01	1	#bipolarmuch	Fight	39.09	-84.35	5km	Point	39.12085159	-84.35594556		Fri Aug 10 05:01:19 +0000 2012	Isn't funny when someone starts a fight with you and then they end apologizing... #bipolarmuch ?	
12358	173095056092315650	ashwee316	2012-02-24 12:20	0	#REALlifeinspiration	Fight	39.09	-84.35	5km	Point	39.1262781	-84.3539969		Fri Feb 24 17:20:51 +0000 2012	watching a wonderful woman fight a daily battle with cancer simply to enjoy life again & play with her grandson outside #REALlifeinspiration	
12359	161207189397192704	mrothhaas	2012-01-22 17:02	0	#obsessed	Fight	39.09	-84.35	5km	Point	39.11926996	-84.33352684	Cincinnati • Columbia	Sun Jan 22 22:02:43 +0000 2012	life's too short to give in, so you gotta fight for what's yours loveee greys anatomy #obsessed	
12360	262781545121726464	kelseynicho1e	2012-10-29 01:02	0	#Thatawkwardmoment	Fight	39.09	-84.41	5km	Point	39.1290552	-84.43020208		Mon Oct 29 05:02:57 +0000 2012	#Thatawkwardmoment when you feel you're about to witness a fight at a sushi place..	
12361	233928023538294784	TheRealJeffRuby	2012-08-10 10:09	9		Fight	39.09	-84.41	5km	Point	39.12174147	-84.44657542	cincinnati usa	Fri Aug 10 14:09:21 +0000 2012	I didn't fight my way up the food chain to end up being a Vegan	
12362	223937784765882369	G_H32	2012-07-13 20:31	0		Fight	39.09	-84.41	5km	Point	39.11666518	-84.43466708	'Merica	Sat Jul 14 00:31:43 +0000 2012	I could watch Fight Club 1000 times and never get bored of it.	
12363	180024977381265410	_iTweetYouBlow	2012-03-14 16:17	0	#OnlyinSTL	Fight	39.09	-84.41	5km	Point	39.1215005	-84.45031179	(513)  via (314)	Wed Mar 14 20:17:53 +0000 2012	#OnlyinSTL where girl fight over imos.	
12364	276966016523841537	One_Time_103	2012-12-07 03:26	0		Fight	39.09	-84.44	5km	Point	39.1255149	-84.47640173	Cincinnati, Ohio, Rio Grande	Fri Dec 07 08:26:58 +0000 2012	Jus seen da funniest fight lol	
12365	273316260949925888	SmittyBull	2012-11-27 01:44	0		Fight	39.09	-84.44	5km	Point	39.13373914	-84.43567287	Philadelphia & Cincinnati	Tue Nov 27 06:44:09 +0000 2012	Fight 2 make dreams reality. Even at our lowest anyone can rise up...	
12366	264569134136819712	KurlyHeadedFuk5	2012-11-02 23:26	0		Fight	39.09	-84.44	5km	Point	39.11300507	-84.47307388	NKY/Cincinnati	Sat Nov 03 03:26:11 +0000 2012	Huge fight at the bar, I was caught in the middle of it. Fuck that shit. Left that bullshit	
12367	259145022396588032	MrCrazyHimself	2012-10-19 00:12	0		Fight	39.09	-84.44	5km	Point	39.101821	-84.4945049	Atlanta, GA	Fri Oct 19 04:12:42 +0000 2012	We was about to fight outside lol	
12368	257905438136360960	G_PaidForIt	2012-10-15 14:07	0	#Beast	Fight	39.09	-84.44	5km	Point	39.08368115	-84.50363405	NKY	Mon Oct 15 18:07:02 +0000 2012	I Love The Fact That My Sister Can Fight :) #Beast	
12369	254580359025549312	Kate_Kenny93	2012-10-06 09:54	0		Fight	39.09	-84.44	5km	Point	39.10103364	-84.49759556	Cincinnati Ohio	Sat Oct 06 13:54:22 +0000 2012	Hanging out with the boys of Chris Carr and company in the fight to end Alzheimer's http://t.co/1qmJKvCc	
12370	248679917968035840	topix_ky	2012-09-20 03:08	0	#Bellevue #Kentucky	Fight	39.09	-84.44	5km	Point	39.1064488	-84.478831	Kentucky	Thu Sep 20 07:08:07 +0000 2012	How you can help fight cancer - http://t.co/Q2sPMztQ #Bellevue #Kentucky	
12371	248575147093684225	reederhoff	2012-09-19 20:11	0	#smh	Fight	39.09	-84.44	5km	Point	39.10404367	-84.48595351	Northern Kentucky	Thu Sep 20 00:11:48 +0000 2012	I know my hipster neighbors have had a fight when I find my yard full of broken vinyls thrown from their window #smh	
12372	240283671972675586	lostinthewash	2012-08-27 23:04	0		Fight	39.09	-84.44	5km	Point	39.092462	-84.499808	Cincinnati, USA	Tue Aug 28 03:04:26 +0000 2012	@livingontheair, you have no idea how happy this makes me. Ramjack  @ Ramjack Studio B: Krazy Kat Fight Club http://t.co/i0rWD2up	
12373	281912477992755200	MeechLuciano	2012-12-20 19:02	0		Fight	39.09	-84.47	5km	Point	39.1150035	-84.5198769	Southbeach Miami 	Fri Dec 21 00:02:27 +0000 2012	It's goin to be an alien invasion tomarow I'm ready to fight	
12374	280082338195574784	DarrylPeeks	2012-12-15 17:50	0		Fight	39.09	-84.47	5km	Point	39.12003662	-84.49159013	SAYING WHATS ON MY MIND	Sat Dec 15 22:50:07 +0000 2012	welcome back boxing to CBS that was a good  fight. Santa Cruz. will be hard to take his belt. the boxing game back in bizniss free boxing	
12375	277703459157995520	IamMeics	2012-12-09 04:17	0		Fight	39.09	-84.47	5km	Point	39.12931175	-84.48445542	Cincinnati 	Sun Dec 09 09:17:18 +0000 2012	They way we fight mfs ah think we together geeeesh	
12376	277654012659113985	DarrylPeeks	2012-12-09 01:00	0		Fight	39.09	-84.47	5km	Point	39.1190573	-84.4977897	SAYING WHATS ON MY MIND	Sun Dec 09 06:00:49 +0000 2012	Great fight thats why I love BOXING.UFC ..WHAT DANA	
12377	277471080434790400	iGotTheTea1	2012-12-08 12:53	2		Fight	39.09	-84.47	5km	Point	39.12634399	-84.48879559	CINCY, OHIO ✈ BRONX, ️NY, 	Sat Dec 08 17:53:55 +0000 2012	WHITE hoes cannot fight bra! I'll be scared to fight you LICE havin Rats anyways .	
12378	276523840224514048	IamMeics	2012-12-05 22:09	2		Fight	39.09	-84.47	5km	Point	39.12932847	-84.48444896	Cincinnati 	Thu Dec 06 03:09:55 +0000 2012	If u don have a sense of humor u gon wanna fight me *shrugs*	
12379	274952915683270657	IamMeics	2012-12-01 14:07	0		Fight	39.09	-84.47	5km	Point	39.12928128	-84.48451099	Cincinnati 	Sat Dec 01 19:07:38 +0000 2012	I mean ain Nothin wrong wit fighting for what u love! But y u fighting for someone who wouldn't even put up a fight for u???	
12380	274682717298364416	IamMeics	2012-11-30 20:13	0		Fight	39.09	-84.47	5km	Point	39.12899688	-84.48429993	Cincinnati 	Sat Dec 01 01:13:57 +0000 2012	@bradleyripstuna still would of had to fight u	
12381	270363543944175616	IamMeics	2012-11-18 22:11	3		Fight	39.09	-84.47	5km	Point	39.1293032	-84.48439993	Cincinnati 	Mon Nov 19 03:11:06 +0000 2012	I hate when ppl go to the club to fight!!	
12382	270040902947438592	Lpietrantonio	2012-11-18 00:49	0		Fight	39.09	-84.47	5km	Point	39.12582977	-84.50458729		Sun Nov 18 05:49:03 +0000 2012	@KingJames you need to fight GSP I know you would whoop that ass	
12383	282917515355627521	iGotTheTea1	2012-12-23 13:36	2		Fight	39.09	-84.5	5km	Point	39.13379254	-84.48934435	CINCY, OHIO ✈ BRONX, ️NY, 	Sun Dec 23 18:36:06 +0000 2012	OMG!!!! HALF YOU CINCINNATI HOES CANNOT FIGHT!!!!!!!!! Gone bra forreal! Bye... I'm off here you hoes ain't go bust a grape.	
12384	279371029971890176	coreyallendavis	2012-12-13 18:43	0	#replacebandnameswithdad	Fight	39.09	-84.5	5km	Point	39.13158563	-84.50951062	Cincinnati, OH	Thu Dec 13 23:43:38 +0000 2012	#replacebandnameswithdad Dad Fight	
12385	278649602025074688	zjohns93	2012-12-11 18:56	0	#toontownprobs	Fight	39.09	-84.5	5km	Point	39.13150925	-84.51215492	Cincinnati	Tue Dec 11 23:56:56 +0000 2012	It's sad that the most exciting part of my day has consisted of watching @Jenna_tweeted fight cogs on toontown. #toontownprobs	
12386	276850912612450304	Claymore_13	2012-12-06 19:49	0		Fight	39.09	-84.5	5km	Point	39.12561684	-84.52222285	Lakewood, OH	Fri Dec 07 00:49:35 +0000 2012	@sh0e82 fight me?	
12387	276574520909910016	iGotTheTea1	2012-12-06 01:31	0		Fight	39.09	-84.5	5km	Point	39.13378743	-84.48955799	CINCY, OHIO ✈ BRONX, ️NY, 	Thu Dec 06 06:31:18 +0000 2012	Ha kill it “@Im_DJ_3D: Can't wait to fight Nee Nee next week. She need a beating ha”	
12388	276574234963214336	beckyjanethomas	2012-12-06 01:30	0	#ridiculous #calmyourtits	Fight	39.09	-84.5	5km	Point	39.12872166	-84.51709027	celina, ohio	Thu Dec 06 06:30:10 +0000 2012	lol at the twitter fight tonight #ridiculous #calmyourtits	
12389	276544656223895552	iGotTheTea1	2012-12-05 23:32	0		Fight	39.09	-84.5	5km	Point	39.13385105	-84.48942496	CINCY, OHIO ✈ BRONX, ️NY, 	Thu Dec 06 04:32:38 +0000 2012	RT'n WHITE HOES on my TL would get you UNFOLLOWED . Dey can't even FIGHT! So dem flexin tweets are disqualified	
12390	276460029710831616	Goergen1	2012-12-05 17:56	0		Fight	39.09	-84.5	5km	Point	39.13123607	-84.51276642	Chicago, IL	Wed Dec 05 22:56:22 +0000 2012	Who wants to have a TIDE Pods fight next summer?	
12391	279450249397940224	CClassCClown	2012-12-13 23:58	1		Fight	39.09	-84.53	5km	Point	39.1273039	-84.5501819	SINSINNATI	Fri Dec 14 04:58:26 +0000 2012	@WeezyF_Babyy who he was fight	
12392	278035753731252225	KatitaMartina	2012-12-10 02:17	0		Fight	39.09	-84.53	5km	Point	39.13308507	-84.5215896	(914) - (937) - (513) 	Mon Dec 10 07:17:44 +0000 2012	@sara_martin87 @kaywuhhh @annamariewolf I'm on it right now, wanna fight about it?	
12393	274919116056432640	KissMyAwesomnes	2012-12-01 11:53	0		Fight	39.09	-84.53	5km	Point	39.1302582	-84.5191492	AnywhereButHere	Sat Dec 01 16:53:19 +0000 2012	I want  to be with him I love him.  I think about him every day.  And I just want him to fight for me so we can make it work . I'm indenial	
12394	278614413378998273	JTripp0815	2012-12-11 16:37	0		Fight	39.09	-84.56	5km	Point	39.12615778	-84.57793672	Cincinnati, Oh	Tue Dec 11 21:37:07 +0000 2012	We gon fight for our right to love, yeahh.	
12395	278325715844354048	miss_nayz	2012-12-10 21:29	0	#AtDater	Fight	39.09	-84.56	5km	Point	39.1271422	-84.5915944	nyc----- cincinnati 	Tue Dec 11 02:29:56 +0000 2012	#AtDater me &amp; @YungDizzy_MCB were the only ppl  that could get away wit having a egg &amp; powder fight in the middle of class.	
12396	277973144940195841	JTripp0815	2012-12-09 22:08	0		Fight	39.09	-84.56	5km	Point	39.12145839	-84.59098927	Cincinnati, Oh	Mon Dec 10 03:08:56 +0000 2012	Fight fire with fire.	
12397	277881672794533888	miss_nayz	2012-12-09 16:05	1		Fight	39.09	-84.56	5km	Point	39.1271369	-84.5915919	nyc----- cincinnati 	Sun Dec 09 21:05:28 +0000 2012	Me &amp;  @Call_Me_MJ  are gonna fight.	
12398	270017478783037442	jlthrift	2012-11-17 23:15	0	#latenightfight	Fight	39.09	-84.56	5km	Point	39.1106058	-84.5192681	Cincinnati, OH	Sun Nov 18 04:15:58 +0000 2012	One fight until UFC 154 main event. #latenightfight	
12399	269999818183684096	EMPRYL	2012-11-17 22:05	0	#hookrightgoodnight	Fight	39.09	-84.56	5km	Point	39.11228896	-84.52414592	West End Cincinnati, Ohio	Sun Nov 18 03:05:47 +0000 2012	About to watch this fight and see what the kid from Cincinnati @AdrienBroner gonna do tonight!!! #hookrightgoodnight	
12400	281588009613279233	Ms_ash_ley	2012-12-19 21:33	0		Fight	39.09	-84.59	5km	Point	39.13270415	-84.5895481	Ohio, USA	Thu Dec 20 02:33:07 +0000 2012	I wanna fight that dude name Sharmar	
12401	281542738837659648	Ms_ash_ley	2012-12-19 18:33	0		Fight	39.09	-84.59	5km	Point	39.13271313	-84.58941218	Ohio, USA	Wed Dec 19 23:33:14 +0000 2012	@ImLowKeyFamous if one more person tell me you cute . We gon fight big bra	
12402	278555474129993728	Ms_ash_ley	2012-12-11 12:42	0		Fight	39.09	-84.59	5km	Point	39.13270093	-84.58935846	Ohio, USA	Tue Dec 11 17:42:55 +0000 2012	Me and my friend gon fight sap sap	
12403	278358446443749377	Ms_ash_ley	2012-12-10 23:39	0		Fight	39.09	-84.59	5km	Point	39.13291123	-84.58935929	Ohio, USA	Tue Dec 11 04:39:59 +0000 2012	They just need to fight and get the shit over with	
12404	270662036009132033	Antwanec_Moena	2012-11-19 17:57	0		Fight	39.09	-84.59	5km	Point	39.1325674	-84.589589	Cincinnati , Ohio	Mon Nov 19 22:57:12 +0000 2012	Learn How To Fight For Your Rights , Or People Ah Walk Over U All Your Life	
12405	268506963174895616	LegendaryDaylon	2012-11-13 19:13	0	#NoMoreWords	Fight	39.09	-84.59	5km	Point	39.1334968	-84.5916739	HousAtlantaVegas	Wed Nov 14 00:13:43 +0000 2012	Ppl need ta just quit talkin and fight!! #NoMoreWords	
12406	265931544047255552	KaylaCole88	2012-11-06 16:39	0		Fight	39.09	-84.59	5km	Point	39.12617214	-84.61604266	Cincinnati, Ohio.	Tue Nov 06 21:39:55 +0000 2012	@BrittAnderson5 I actually don't. It's not a fight. Just stop thinking my tweets are a about you.	
12407	262954770120208384	PhillipRomeo87	2012-10-29 12:31	0		Fight	39.09	-84.59	5km	Point	39.12182262	-84.58147468	Cincinnat, OH	Mon Oct 29 16:31:17 +0000 2012	@lilbigme55 every action has a reaction! Can't fight physics	
12408	262023965395001344	hollisjr3425	2012-10-26 22:52	0		Fight	39.09	-84.59	5km	Point	39.133277	-84.5782966		Sat Oct 27 02:52:36 +0000 2012	Watching The Ultimate Fighter, both guys can't fight. Call that a DRAW!.	
12409	259671192473051136	So_Al_like	2012-10-20 11:03	0		Fight	39.09	-84.59	5km	Point	39.10030478	-84.53044981	My own world!	Sat Oct 20 15:03:31 +0000 2012	@DjBEANZ_Iam lol no Wat fight	
12410	257333191617167362	Josh_Morford	2012-10-14 00:13	0		Fight	39.09	-84.59	5km	Point	39.1117626	-84.55384643	Terre Haute, IN	Sun Oct 14 04:13:08 +0000 2012	IU is so close. I love the fight in these guys. Gotta win the next 2 for a chance at the bowl game.	
12411	251901248192778241	TheOnlyPortiaG	2012-09-29 00:28	0		Fight	39.09	-84.59	5km	Point	39.1231458	-84.5652801	Cincinnati oh	Sat Sep 29 04:28:32 +0000 2012	Im the type a girl that a nigga like when Shit jump off I help my nigga fight	
12412	251883964665573377	Ms_CheetahPrint	2012-09-28 23:19	0		Fight	39.09	-84.59	5km	Point	39.12602556	-84.55368818	NoMakeupJustLipGloss	Sat Sep 29 03:19:51 +0000 2012	I wanna see a fight	
12413	265566690090303490	Haileyy_Mariee_	2012-11-05 16:30	0		Fight	39.09	-84.62	5km	Point	39.13311535	-84.61137527		Mon Nov 05 21:30:07 +0000 2012	@GJKippenbrock haha oh I was like , o u tryina fight ?!(;	
12414	246096809225764864	becca_snow	2012-09-13 00:03	0		Fight	39.09	-84.62	5km	Point	39.11623	-84.61212		Thu Sep 13 04:03:46 +0000 2012	@Spaynce last night I dreamed that me and taylor swift got married to the same jonas brother.. We got into a really big fight	
12415	242312131062677505	IWasBorn2MakeIt	2012-09-02 13:24	0		Fight	39.09	-84.62	5km	Point	39.1304797	-84.5990893	cincinnati	Sun Sep 02 17:24:48 +0000 2012	RT IF YOU REMEMBER YOUR FIRST FIGHT	
12416	238593763331694592	CodeyHedger	2012-08-23 07:09	0		Fight	39.09	-84.62	5km	Point	39.12976291	-84.62181444	Cincinnati	Thu Aug 23 11:09:20 +0000 2012	@RachaelBuzek ohh, you'll get better. Getting yourself out there is half the fight. Good job!	
12417	237218766239457281	__NironSteele	2012-08-19 12:05	0		Fight	39.09	-84.62	5km	Point	39.1250792	-84.5789659	Winton Terrace, United States	Sun Aug 19 16:05:35 +0000 2012	@SuckaFree_Quez Fight who?	
12418	236886988161167360	CodeyHedger	2012-08-18 14:07	0		Fight	39.09	-84.65	5km	Point	39.12952712	-84.62224854	Cincinnati	Sat Aug 18 18:07:13 +0000 2012	@iamcalvinlock dang! Now if you just knew how to fight...	
